关键字,分类,上级,下级
土壤,土壤与植被,土壤与植被、陆生植被的分布主要受气候、土壤、地形等因素影响,成土因素、土壤性质、土壤类型、土壤肥力、保持水土、保肥、冰沼土、冲积土、冻土、冻土发育、冻土扩大、冻土扩张、土壤极肥沃、土壤熟化、土壤肥力上升、土壤肥力提高、土层加厚、肥力上升、土层厚、植被好、土层变薄、肥力下降、土层更薄、土层浅薄、土层深厚、土层薄、植被差、壤土、多为黑土、寒冷冻土、寒冷冻土广、森林 — 黑土、灰化土、盐碱荒漠、盐碱重、植被少、砂土、砖红壤、草原 — 黑钙土、荒漠 — 荒漠土、酸性、泥炭化、风沙土、黏土、黑钙土
土壤与植被,生物地理,地理自然系统,土壤、植被、生物循环、一样、一致、中性、熟化、肥沃、光照过强、养分保持、农田、冠层厚、枯枝落叶多、冻融加强、减少水分消耗、减缓径流、增加下渗、加快径流、减少下渗、南方水田区、只施化肥、叶片光合作用、呈强酸性、呈碱性、固定沙丘、减弱风蚀、增加光合作用、增施有机肥、大量浇水、完全不同、干湿分明、开花结果、弱、强、持续培肥、施用石灰、更加茂盛、更肥沃、有机质低、有机质分解快、流失多、有机质极高、有机质高、根系呼吸、根系更浅、比较贫瘠、气温太低、水分储存、水分短缺、水热充足、循环快、江南丘陵、沉积、加厚、沙漠、泥沙淤积、养分丰富、浅薄贫瘠、海岸线、淋溶极强、深厚肥沃、生长不良、相反、矿物养分丰富、碱性强、肥力高、绿洲、肥力提高、肥力更高、蒸发更少、蒸发极强、西北盆地、覆盖更低、质地变粗、肥力下降、质地变细、肥力上升、酸性强、肥力低、酸性更强、降低下渗、增加径流、陡峭山区、雪线、青藏高原区、非常肥沃、高产农田、高寒区、土层厚、植被好
土壤侵蚀,锚点词,土壤与植被,降水
土壤侵蚀作用越强,土壤与植被,坡度越大，土壤侵蚀作用越强，土层越薄,
土壤侵蚀越严重,土壤与植被,植被覆盖度越低，土壤侵蚀越严重,
土壤保水性是指土壤保持水分的能力,土壤与植被,土壤保水性是指土壤保持水分的能力，与土壤质地密切相关,
土壤保水性是指土壤保持水分的能力，与土壤质地密切相关,决策型,题目选项,土壤保水性是指土壤保持水分的能力、与土壤质地密切相关、土壤质地密切相关
土壤保水性过强,土壤与植被,土壤保水性过强，会导致土壤积水，影响植物根系呼吸,
土壤保水性过强，会导致土壤积水，影响植物根系呼吸,决策型,题目选项,土壤保水性过强、会导致土壤积水、影响植物根系呼吸、保水性适中最好，过强会导致涝灾。
土壤养分主要来源于土壤有机质分解,土壤与植被,土壤养分主要来源于土壤有机质分解和矿物质风化,
土壤养分主要来源于土壤有机质分解和矿物质风化,决策型,题目选项,土壤养分主要来源于土壤有机质分解、矿物质风化
土壤养分含量是重要的评价指标,土壤与植被,土壤有机质含量、土壤养分含量是重要的评价指标,
土壤冻结,锚点词,土壤与植被,苔原
土壤发育速度快于阴坡,土壤与植被,阳坡接受太阳辐射多，气温高，土壤发育速度快于阴坡,
土壤含水量越高,土壤与植被,土壤含水量越高，空气含量越低,
土壤含水量越高，空气含量越低,决策型,题目选项,土壤含水量越高、空气含量越低、不一定降低空气含量
土壤呈酸性,土壤与植被,土壤呈酸性，有机质含量较低，肥力中等,
土壤呈酸性，有机质含量较低，肥力中等,决策型,题目选项,土壤呈酸性、有机质含量较低、肥力中等
土壤多碱性,土壤与植被,温带大陆性气候区，降水少，蒸发旺盛，土壤多碱性，有机质含量较高,
土壤形成是一个漫长的过程,土壤与植被,土壤形成是一个漫长的过程，需要数百年甚至上千年,
土壤形成是一个漫长的过程，需要数百年甚至上千年,决策型,题目选项,土壤形成是一个漫长的过程、需要数百年甚至上千年
土壤形成的顺序是：成土母质→原始土壤→成熟土壤,决策型,题目选项,
土壤影响植被的生长,土壤与植被,植被改变土壤的理化性质，土壤影响植被的生长和分布,
土壤影响植被的生长和分布,土壤与植被,植被改变土壤的理化性质，土壤影响植被的生长和分布,
土壤微生物能分解土壤有机质,土壤与植被,土壤微生物能分解土壤有机质，释放养分，供植物吸收,
土壤微生物能分解土壤有机质，释放养分，供植物吸收,决策型,题目选项,土壤微生物能分解土壤有机质、释放养分、供植物吸收、土壤微生物多数有益
土壤微生物能改善土壤结构,土壤与植被,土壤微生物能改善土壤结构，增加土壤透气性,
土壤微生物能改善土壤结构，增加土壤透气性,决策型,题目选项,土壤微生物能改善土壤结构、增加土壤透气性
土壤性质,生物地理,土壤,土壤质地、土壤酸碱性、土壤结构、有机质
土壤是农业生产的基础,土壤与植被,土壤是农业生产的基础，保护土壤能保障粮食安全,
土壤是农业生产的基础，保护土壤能保障粮食安全,决策型,题目选项,土壤是农业生产的基础、保护土壤能保障粮食安全
土壤有机质分解慢,土壤与植被,寒带气候区，气温低，土壤有机质分解慢，土层薄,
土壤有机质分解速度越快,土壤与植被,气温越高，土壤有机质分解速度越快，有机质含量越低,
土壤有机质含量,土壤与植被,土壤有机质含量、土壤养分含量是重要的评价指标,
土壤有机质含量、土壤养分含量是重要的评价指标,决策型,题目选项,土壤有机质含量、土壤养分含量是重要的评价指标
土壤有机质含量越高,土壤与植被,土壤有机质含量越高，土壤肥力通常越高、土壤有机质含量越高，颜色越深（如黑土）,
土壤有机质含量越高，土壤肥力通常越高,决策型,题目选项,土壤有机质含量越高、土壤肥力通常越高
土壤有机质含量越高，颜色越深（如黑土）,决策型,题目选项,土壤有机质含量越高、颜色越深（如黑土）、土壤颜色是肥力的重要参考，如黑土肥力高。
土壤有机质含量较高,土壤与植被,土壤有机质含量较高，肥力较强,
土壤有机质含量较高，肥力较强,决策型,题目选项,土壤有机质含量较高、肥力较强
土壤有机质含量高,土壤与植被,土壤有机质含量高，颜色呈黑色，质地疏松,
土壤有机质含量高，颜色呈黑色，质地疏松,决策型,题目选项,土壤有机质含量高、颜色呈黑色、质地疏松
土壤条件的植物品种,土壤与植被,植被恢复应选择适合当地气候和土壤条件的植物品种、因地制宜，选择适合当地气候和土壤条件的植物品种,
土壤极肥沃,选项词,题目选项,
土壤水分,锚点词,土壤与植被,黏土
土壤水分不足,土壤与植被,土壤水分不足，植物会缺水枯萎；水分过多，会导致根系缺氧腐烂,
土壤水分不足，植物会缺水枯萎；水分过多，会导致根系缺氧腐烂,决策型,题目选项,土壤水分不足、植物会缺水枯萎、水分过多、会导致根系缺氧腐烂
土壤水分含量通常越高,土壤与植被,降水越多，土壤水分含量通常越高,
土壤沙化,土壤与植被,土壤沙化、退化,
土壤沙化、退化,决策型,题目选项,土壤沙化、退化
土壤淋溶作用强,土壤与植被,热带季风气候区，降水丰富，土壤淋溶作用强，多酸性土壤,
土壤熟化,选项词,题目选项,
土壤的淋溶作用越强,土壤与植被,降水越多，土壤的淋溶作用越强，养分流失越明显,
土壤盐碱化,决策型,题目选项,
土壤相互制约,土壤与植被,植被与土壤相互制约，一方破坏会导致另一方退化,
土壤空气不足,土壤与植被,土壤空气不足，会导致植物根系缺氧，生长缓慢甚至死亡,
土壤空气不足，会导致植物根系缺氧，生长缓慢甚至死亡,决策型,题目选项,土壤空气不足、会导致植物根系缺氧、生长缓慢甚至死亡
土壤空气充足,土壤与植被,土壤空气充足，植物根系呼吸旺盛，生长健壮,
土壤空气充足，植物根系呼吸旺盛，生长健壮,决策型,题目选项,土壤空气充足、植物根系呼吸旺盛、生长健壮、土壤空气直接影响植物根系呼吸。、土壤空气直接影响植物根系呼吸
土壤类型,土壤类型,土壤,高寒冻土区
土壤组合,锚点词,土壤与植被,荒漠 — 荒漠土
土壤肥力,生物地理,土壤,肥沃、贫瘠、养分流失、有机质积累、肥力高、高温多雨淋溶强
土壤肥力上升,选项词,题目选项,
土壤肥力下降,土壤与植被,植被破坏会加剧土壤侵蚀，导致土层变薄、土壤肥力下降、过度放牧会导致植被破坏，土壤肥力下降,
土壤肥力提高,选项词,题目选项,
土壤肥力越高,土壤与植被,土壤肥力越高，植被生长越旺盛，覆盖率越高、植被越茂盛，土壤肥力越高、土壤越肥沃，植被生长越旺盛,
土壤肥力越高，植被生长越旺盛，覆盖率越高,决策型,题目选项,土壤肥力越高、植被生长越旺盛、覆盖率越高
土壤肥力通常越高,土壤与植被,土壤有机质含量越高，土壤肥力通常越高,
土壤能调节生态环境,土壤与植被,土壤能调节生态环境，保护土壤能维护生态平衡,
土壤能调节生态环境，保护土壤能维护生态平衡,决策型,题目选项,土壤能调节生态环境、保护土壤能维护生态平衡
土壤质地密切相关,土壤与植被,土壤保水性是指土壤保持水分的能力，与土壤质地密切相关,
土壤质地影响植被类型,土壤与植被,土壤质地影响植被类型，砂土适合耐旱植物生长,
土壤质地影响植被类型，砂土适合耐旱植物生长,决策型,题目选项,土壤质地影响植被类型、砂土适合耐旱植物生长、酸碱度显著影响植被分布，如喜酸植物在酸性土壤生长。
土壤质地越疏松（如砂土）,土壤与植被,土壤质地越疏松（如砂土），空气含量越高,
土壤质地越疏松（如砂土），空气含量越高,决策型,题目选项,土壤质地越疏松（如砂土）、空气含量越高
土壤质地越黏重,土壤与植被,土壤质地越黏重，保水能力越强，水分含量越高,
土壤质地越黏重，保水能力越强，水分含量越高,决策型,题目选项,土壤质地越黏重、保水能力越强、水分含量越高
土壤资源分布不均,土壤与植被,土壤资源分布不均，受气候、地形等因素影响,
土壤资源分布不均，受气候、地形等因素影响,决策型,题目选项,土壤资源分布不均、受气候、地形等因素影响
土壤资源数量有限,土壤与植被,土壤资源数量有限，需合理保护和利用,
土壤资源数量有限，需合理保护和利用,决策型,题目选项,土壤资源数量有限、需合理保护和利用、需合理保护、利用
土壤资源是可再生资源,土壤与植被,土壤资源是可再生资源，但再生速度缓慢,
土壤资源是可再生资源，但再生速度缓慢,决策型,题目选项,土壤资源是可再生资源、但再生速度缓慢、土壤资源具有可再生性、分布不均和有限性的特点。、土壤资源具有可再生性
土壤越肥沃,土壤与植被,植被越茂盛，土壤肥力越高；土壤越肥沃，植被生长越旺盛,
土壤退化,决策型,题目选项,
土壤透气性,土壤与植被,土壤透气性和透水性良好，能提高土壤肥力、土壤透气性、透水性、保水性也是评价土壤肥力的指标,
土壤透气性、透水性、保水性也是评价土壤肥力的指标,决策型,题目选项,土壤透气性、透水性、保水性也是评价土壤肥力的指标
土壤透气性和透水性良好,土壤与植被,土壤透气性和透水性良好，能提高土壤肥力,
土壤透气性和透水性良好，能提高土壤肥力,决策型,题目选项,土壤透气性和透水性良好、土壤透气性、透水性良好、能提高土壤肥力
土壤透气性好,土壤与植被,土壤透气性好，氧气充足,
土壤透气性好，氧气充足,决策型,题目选项,土壤透气性好、氧气充足
土壤通气,锚点词,土壤与植被,壤土
土壤通气性越好,土壤与植被,土壤通气性越好，越有利于植物根系呼吸和微生物活动,
土壤通气性越好，越有利于植物根系呼吸和微生物活动,决策型,题目选项,土壤通气性越好、越有利于植物根系呼吸和微生物活动、越有利于植物根系呼吸、微生物活动
土壤通气性过强,土壤与植被,土壤通气性过强，会导致土壤水分快速蒸发，不利于植物生长,
土壤通气性过强，会导致土壤水分快速蒸发，不利于植物生长,决策型,题目选项,土壤通气性过强、会导致土壤水分快速蒸发、不利于植物生长
土壤酸化,选项词,题目选项,
土壤酸碱度失衡,土壤与植被,滥用化肥会导致土壤板结，土壤酸碱度失衡,
土壤酸碱性,土壤类型,土壤,中性、呈酸性、强酸性、碱性、酸性
土壤颜色越红（如红壤）,土壤与植被,氧化铁含量越高，土壤颜色越红（如红壤）,
土层,锚点词,土壤与植被,侵蚀、滑塌
土层加厚,选项词,题目选项,
土层加厚、肥力上升,选项词,题目选项,
土层厚,土壤与植被,土层厚、植被好,
土层厚、植被好,决策型,题目选项,土层厚、植被好
土层变薄,土壤与植被,土层变薄、肥力下降,
土层变薄、肥力下降,决策型,题目选项,土层变薄、肥力下降
土层更薄,选项词,题目选项,
土层浅薄,决策型,题目选项,
土层深厚,选项词,题目选项,
土层薄,土壤与植被,题目选项、寒带气候区，气温低，土壤有机质分解慢，土层薄,
土层薄、植被差,选项词,题目选项,
土层越薄,土壤与植被,坡度越大，土壤侵蚀作用越强，土层越薄,
土是,锚点词,土壤与植被,南方水田区
地下水,锚点词,土壤与植被,盐碱土
地下水位,锚点词,土壤与植被,次生盐碱化
地下水影响,土壤与植被,盐碱土多分布在干旱、半干旱地区，受地形和地下水影响,
地下水盐分易上升到地表积累,土壤与植被,干旱、半干旱地区，蒸发旺盛，地下水盐分易上升到地表积累,
地中海气候,决策型,题目选项,
地势,锚点词,土壤与植被,土层厚、植被好
地势低洼,土壤与植被,地势低洼，排水不畅，盐分易聚集,
地势低洼，排水不畅，盐分易聚集,决策型,题目选项,地势低洼、排水不畅、盐分易聚集
地带,锚点词,土壤与植被,雨林→阔叶林→针叶林→苔原
地带性,锚点词,土壤与植被,一致
地形,地形地貌,成土因素,坡度、坡向、海拔、山区、平原、保持水土、保肥
地形等因素影响,土壤与植被,陆生植被的分布主要受气候、土壤、地形等因素影响、土壤资源分布不均，受气候,
地理自然系统,通用,无,气象与气候、地形地貌、水文地理、土壤与植被
地表径流引起,土壤与植被,水力侵蚀是最常见的土壤侵蚀类型，主要由降水和地表径流引起,
地表缺乏保护,土壤与植被,植被覆盖度低，地表缺乏保护,
坡向,锚点词,土壤与植被,阴坡
坡度,地形地貌,地形,陡坡、缓坡、地表径流速度、保持水土、保肥
坡度越大,土壤与植被,坡度越大，土壤侵蚀作用越强，土层越薄,
坡度越大，土壤侵蚀作用越强，土层越薄,决策型,题目选项,坡度越大、土壤侵蚀作用越强、土层越薄
垂直分层能提高植被对光照,土壤与植被,垂直分层能提高植被对光照、水分等资源的利用效率,
垂直分层能提高植被对光照、水分等资源的利用效率,决策型,题目选项,垂直分层能提高植被对光照、水分等资源的利用效率
垂直分布因素,选项类型,土壤与植被,热量
基带,锚点词,土壤与植被,一致
增加下渗,土壤与植被,减缓径流、增加下渗,
增加光合作用,选项词,题目选项,
增加土壤透气性,土壤与植被,植物的根系能疏松土壤，增加土壤透气性和透水性、能改善土壤结构，增加土壤透气性和保水性、土壤微生物能改善土壤结构，增加土壤透气性、改善土壤结构，增加土壤透气性和保水性,
增加土壤透气性和保水性,土壤与植被,能改善土壤结构，增加土壤透气性和保水性、改善土壤结构，增加土壤透气性和保水性,
增加土壤透气性和透水性,土壤与植被,植物的根系能疏松土壤，增加土壤透气性和透水性,
增加空气湿度,土壤与植被,能调节气候，增加空气湿度，净化空气、增加空气湿度，促进降水，调节区域气候,
增加空气湿度，促进降水，调节区域气候,决策型,题目选项,增加空气湿度、促进降水、调节区域气候
增加蒸发、减少降水,选项词,题目选项,
增加蒸发、加剧干旱,选项词,题目选项,
增加降水,土壤与植被,调节气候，降低气温日较差和年较差，增加降水,
增强,锚点词,土壤与植被,土层变薄、肥力下降
增施有机肥,决策型,题目选项、增施有机肥，提高土壤有机质含量，改善土壤结构、增施有机肥，能增加土壤有机质，提高红壤肥力,
增施有机肥，提高土壤有机质含量，改善土壤结构,决策型,题目选项,增施有机肥、提高土壤有机质含量、改善土壤结构
增施有机肥，能增加土壤有机质，提高红壤肥力,决策型,题目选项,增施有机肥、能增加土壤有机质、提高红壤肥力
壤土,决策型,题目选项、成土母质的颗粒大小影响土壤的质地（砂土、壤土、黏土）,
壤土的通气性介于两者之间,土壤与植被,砂土的通气性优于黏土，壤土的通气性介于两者之间,
壤土适合种植多种农作物,土壤与植被,壤土适合种植多种农作物，是农业生产的理想土壤,
壤土适合种植多种农作物，是农业生产的理想土壤,决策型,题目选项,壤土适合种植多种农作物、是农业生产的理想土壤
壤土颗粒直径介于砂土,土壤与植被,壤土颗粒直径介于砂土和黏土之间，质地适中,
壤土颗粒直径介于砂土和黏土之间,土壤与植被,壤土颗粒直径介于砂土和黏土之间，质地适中,
壤土颗粒直径介于砂土和黏土之间，质地适中,决策型,题目选项,壤土颗粒直径介于砂土和黏土之间、壤土颗粒直径介于砂土、黏土之间、质地适中
壤土：通气性,土壤与植被,壤土：通气性和保水性都适中，最适合农业生产,
壤土：通气性和保水性都适中,土壤与植被,壤土：通气性和保水性都适中，最适合农业生产,
壤土：通气性和保水性都适中，最适合农业生产,决策型,题目选项,壤土：通气性和保水性都适中、壤土：通气性、保水性都适中、最适合农业生产、不同质地土壤通气保水特性不同，壤土最理想。、不同质地土壤通气保水特性不同
处于,锚点词,土壤与植被,酸性、泥炭化
夏季枝叶繁茂,土壤与植被,夏季枝叶繁茂，能充分利用光照进行光合作用,
夏季枝叶繁茂，能充分利用光照进行光合作用,决策型,题目选项,夏季枝叶繁茂、能充分利用光照进行光合作用
夏季高温多雨,土壤与植被,主要分布在温带季风气候区，夏季高温多雨，冬季寒冷干燥,
外力作用,锚点词,土壤与植被,降水
多为森林植被,土壤与植被,沿海地区降水丰富，多为森林植被,
多为耐旱植物,土壤与植被,植被稀疏，多为耐旱植物，叶片细小或退化为刺,
多为黑土,选项词,题目选项,
多形成沙丘,土壤与植被,风力侵蚀主要发生在干旱、半干旱地区，多形成沙丘、戈壁,
多酸性土壤,土壤与植被,热带季风气候区，降水丰富，土壤淋溶作用强，多酸性土壤,
大于7为碱性土壤,土壤与植被,pH值小于7为酸性土壤，大于7为碱性土壤，等于7为中性土壤,
大多数农作物适合在中性,土壤与植被,大多数农作物适合在中性或微酸性土壤中生长,
大多数农作物适合在中性或微酸性土壤中生长,决策型,题目选项,大多数农作物适合在中性、微酸性土壤中生长
大量浇水,选项词,题目选项,
大陆性气候,锚点词,土壤与植被,森林→草原→荒漠
大面积,锚点词,土壤与植被,湿度下降、温差变大
大风,土壤与植被,寒冷、大风,
失去,锚点词,土壤与植被,土地沙化
如新疆,土壤与植被,荒漠植被主要分布在我国西北内陆地区，如新疆、甘肃,
如红壤,土壤与植被,南方地区多酸性土壤，如红壤、砖红壤,
如花生,土壤与植被,砂土适合种植耐旱、耐贫瘠的作物，如花生、红薯,
如黑土,土壤与植被,北方地区多中性、碱性土壤，如黑土、棕壤,
孔隙,锚点词,土壤与植被,根系呼吸
孔隙度大,土壤与植被,颗粒大，孔隙度大，透气性和透水性强,
孔隙度小,土壤与植被,孔隙度小，透气性和透水性差，易积水,
孔隙度小，透气性和透水性差，易积水,决策型,题目选项,孔隙度小、透气性和透水性差、透气性、透水性差、易积水
季短,锚点词,土壤与植被,苔原
季节,锚点词,土壤与植被,水土流失
季节性强,选项词,题目选项,
季雨林,选项词,题目选项,
季风区,锚点词,土壤与植被,水土流失
季风区降水特点,气候类型,气候,季节性强
季风气候,选项词,题目选项,
宁夏等地区,土壤与植被,温带草原主要分布在我国内蒙古、宁夏等地区,
完全不同,选项词,题目选项,
实施,锚点词,土壤与植被,更肥沃
容易,锚点词,土壤与植被,水土流失
密集,锚点词,土壤与植被,黑钙土
寒冷,锚点词,土壤与植被、寒冷、大风,苔原
寒冷、大风,决策型,题目选项,寒冷、大风
寒冷冻土,选项词,题目选项,
寒冷冻土广,选项词,题目选项,
寒带,选项词,题目选项,
寒带地区气温低,土壤与植被,寒带地区气温低，植被生长期短，甚至无植被生长,
寒带地区气温低，植被生长期短，甚至无植被生长,决策型,题目选项,寒带地区气温低、植被生长期短、甚至无植被生长
寒带气候区,土壤与植被,寒带气候区，气温低，土壤有机质分解慢，土层薄,
寒带气候区，气温低，土壤有机质分解慢，土层薄,决策型,题目选项,寒带气候区、气温低、土壤有机质分解慢、土层薄
对应,锚点词,土壤与植被,地中海气候
导致土壤肥力下降,土壤与植被,过度放牧会破坏草原植被，导致土壤肥力下降,
导致土层变薄,土壤与植被,植被破坏会加剧土壤侵蚀，导致土层变薄、土壤肥力下降,
导致生态恶化,土壤与植被,不合理的人类活动（如滥砍滥伐）会破坏植被，导致生态恶化,
小气候,锚点词,土壤与植被,湿度下降、温差变大
少于,锚点词,土壤与植被,水分
尸体,土壤与植被,主要来源于植物的枯枝落叶、根系和动物的排泄物、尸体,
局部,锚点词,土壤与植被,湿度下降、温差变大
山区,锚点词,土壤与植被,土层厚、植被好
山地,锚点词,土壤与植被,土层浅薄
山地的海拔越高,土壤与植被,山地的海拔越高，植被垂直地带性越明显,
山地的海拔越高，植被垂直地带性越明显,决策型,题目选项,山地的海拔越高、植被垂直地带性越明显、垂直地带性随海拔升高而变化，与纬度地带性有相似性。、垂直地带性随海拔升高而变化
山地的迎风坡植被生长比背风坡好,土壤与植被,山地的迎风坡植被生长比背风坡好，因为降水丰富,
山地的迎风坡植被生长比背风坡好，因为降水丰富,决策型,题目选项,山地的迎风坡植被生长比背风坡好、因为降水丰富
山地的阳坡植被生长比阴坡好,土壤与植被,山地的阳坡植被生长比阴坡好，因为光照充足,
山地的阳坡植被生长比阴坡好，因为光照充足,决策型,题目选项,山地的阳坡植被生长比阴坡好、因为光照充足
山麓,锚点词,土壤与植被,绿洲
巨大,锚点词,土壤与植被,水热充足、循环快
带动旅游业发展,土壤与植被,作为观赏植物，美化环境，带动旅游业发展,
带状,锚点词,土壤与植被,绿洲
带走,锚点词,土壤与植被,质地变粗、肥力下降
常绿阔叶林,土壤与植被,题目选项、东部地区以森林植被为主，从南到北依次为热带雨林、常绿阔叶林、落叶阔叶林、针叶林,
干旱,锚点词,土壤与植被、干旱、半干旱地区，蒸发旺盛，地下水盐分易上升到地表积累、荒漠土壤贫瘠、干旱，仅能生长耐旱的荒漠植被,盐碱土
干旱、半干旱地区，蒸发旺盛，地下水盐分易上升到地表积累,决策型,题目选项,干旱、半干旱地区、蒸发旺盛、地下水盐分易上升到地表积累
干旱、风沙,选项词,题目选项,
干旱区,选项词,题目选项,
