关键字,分类,上级,下级
干旱半干旱低洼区,决策型,题目选项,
干旱气候降水特点,气候类型,气候,稀少
干旱的环境中生长,土壤与植被,适应能力强，能在贫瘠、干旱的环境中生长,
干旱等灾害,土壤与植被,植被破坏会减少涵养水源能力，引发洪涝、干旱等灾害,
干旱缺水,决策型,题目选项,
干旱蒸发强,选项词,题目选项,
干旱风沙区,决策型,题目选项,
干湿,锚点词,土壤与植被,干湿分明
干湿分明,决策型,题目选项,
干燥,锚点词,土壤与植被,地中海气候
平原,锚点词,土壤与植被,肥沃
平缓,锚点词,土壤与植被,深厚肥沃
年较差,土壤与植被,调节气候，降低气温日较差和年较差，增加降水,
延缓土壤退化,土壤与植被,荒漠植被能固定土壤，减少风沙侵蚀，延缓土壤退化,
建立自然保护区,土壤与植被,建立自然保护区，保护原生植被,
建立自然保护区，保护原生植被,决策型,题目选项,建立自然保护区、保护原生植被
开花结果,选项词,题目选项,
引发洪涝,土壤与植被,植被破坏会减少涵养水源能力，引发洪涝、干旱等灾害、加剧水土流失，引发洪涝、泥石流等灾害,
弱,决策型,题目选项,
强,选项词,题目选项,
强烈,锚点词,土壤与植被,红壤
强酸性,选项词,题目选项,
形态,锚点词,土壤与植被,干旱缺水
影响农业生产,土壤与植被,破坏土壤结构，降低土壤肥力，影响农业生产,
影响植物根系呼吸,土壤与植被,土壤保水性过强，会导致土壤积水，影响植物根系呼吸,
径流,锚点词,土壤与植被,土层变薄、肥力下降
循环,锚点词,土壤与植被,比较贫瘠
循环快,土壤与植被,水热充足、循环快,
微生物活动,土壤与植被,土壤通气性越好，越有利于植物根系呼吸和微生物活动,
微生物活动旺盛,土壤与植被,气温高，微生物活动旺盛,
微酸性土壤中生长,土壤与植被,大多数农作物适合在中性或微酸性土壤中生长,
快速退化,选项词,题目选项,
恢复土壤肥力,土壤与植被,轮作休耕能让土壤得到休息，恢复土壤肥力,
恶性循环,决策型,题目选项,
意义,锚点词,土壤与植被,涵养水源
戈壁,土壤与植被,风力侵蚀主要发生在干旱、半干旱地区，多形成沙丘、戈壁,
成土,锚点词,土壤与植被,呈碱性
成土因素,生物地理,土壤,成土母质、气候、生物、地形、时间、人类活动
成土母质,生物地理,成土因素,石灰岩、花岗岩、砂岩、页岩、矿物质、呈碱性
成土母质是土壤形成的物质基础,土壤与植被,成土母质是土壤形成的物质基础，决定土壤的矿物质成分,
成土母质是土壤形成的物质基础，决定土壤的矿物质成分,决策型,题目选项,成土母质是土壤形成的物质基础、决定土壤的矿物质成分、成土母质是土壤的初始物质，决定了矿物质组成和质地，但肥力还受气候、生物等影响。、成土母质是土壤的初始物质、决定了矿物质组成和质地、决定了矿物质组成
成土母质的颗粒大小影响土壤的质地（砂土,土壤与植被,成土母质的颗粒大小影响土壤的质地（砂土、壤土、黏土）,
成土母质的颗粒大小影响土壤的质地（砂土、壤土、黏土）,决策型,题目选项,成土母质的颗粒大小影响土壤的质地（砂土、壤土、黏土）、成土母质是土壤的初始物质
截留,锚点词,土壤与植被,水土流失更轻
扩张,锚点词,土壤与植被,沙漠
抑制,锚点词,土壤与植被,高温多雨淋溶强
持续培肥,决策型,题目选项,
指导农业生产,土壤与植被,指导农业生产，合理利用土壤和植被资源，提高农作物产量,
指导农业生产，合理利用土壤和植被资源，提高农作物产量,决策型,题目选项,指导农业生产、合理利用土壤和植被资源、合理利用土壤、植被资源、提高农作物产量
排水不畅,土壤与植被,地势低洼，排水不畅，盐分易聚集,
措施,锚点词,土壤与植被,只施化肥
提供木材,土壤与植被,题目选项、提供木材、药材、饲料等产品，保障人类生产生活需求,
提供木材、药材、饲料等产品，保障人类生产生活需求,决策型,题目选项,提供木材、药材、饲料等产品、保障人类生产生活需求
提供植物生长所需的养分,土壤与植被,提供植物生长所需的养分，提高土壤肥力,
提供植物生长所需的养分，提高土壤肥力,决策型,题目选项,提供植物生长所需的养分、提高土壤肥力
提高,锚点词,土壤与植被,水土流失
提高pH值,土壤与植被,酸性土壤可施加石灰、草木灰等，提高pH值,
提高农作物产量,土壤与植被,指导农业生产，合理利用土壤和植被资源，提高农作物产量,
提高土壤有机质含量,土壤与植被,增施有机肥，提高土壤有机质含量，改善土壤结构,
提高土壤肥力,土壤与植被,植物残体分解后能增加土壤有机质，提高土壤肥力、植被残体分解后增加土壤有机质，提高土壤肥力、合理施肥能补充土壤养分，提高土壤肥力、森林植被的枯枝落叶分解后，能增加土壤有机质，提高土壤肥力、草原植被的草本植物根系发达，能增加土壤有机质，提高土壤肥力、提供植物生长所需的养分，提高土壤肥力,
提高植被成活率,土壤与植被,优先选择 native 植物，提高植被成活率和稳定性,
提高植被成活率和稳定性,土壤与植被,优先选择 native 植物，提高植被成活率和稳定性,
提高植被覆盖度,土壤与植被,植树造林，提高植被覆盖度，能减少土壤侵蚀、退耕还林、还草，提高植被覆盖度,
提高温度,选项词,题目选项,
提高红壤肥力,土壤与植被,增施有机肥，能增加土壤有机质，提高红壤肥力,
支撑,锚点词,土壤与植被,水分
改变,锚点词,土壤与植被,水稻土
改善土壤性状,土壤与植被,酸性土壤可施加石灰，调节pH值，改善土壤性状,
改善土壤结构,土壤与植被,植被根系能疏松土壤，改善土壤结构、增施有机肥，提高土壤有机质含量，改善土壤结构、秸秆还田能增加土壤有机质，改善土壤结构、改善土壤结构，增加土壤透气性和保水性、改善土壤结构，促进土壤团粒结构形成,
改善土壤结构，促进土壤团粒结构形成,决策型,题目选项,改善土壤结构、促进土壤团粒结构形成
改善土壤结构，增加土壤透气性和保水性,决策型,题目选项,改善土壤结构、增加土壤透气性和保水性、增加土壤透气性、保水性
改善土壤透气性,土壤与植被,森林植被的根系能疏松土壤，改善土壤透气性和透水性,
改善土壤透气性和透水性,土壤与植被,森林植被的根系能疏松土壤，改善土壤透气性和透水性,
改善局部微环境,土壤与植被,能吸收少量水分，减缓土壤蒸发，改善局部微环境,
改善生态环境,土壤与植被,能固定土壤，减少水土流失，改善生态环境、植被恢复能增加植被覆盖度，减少土壤侵蚀，改善生态环境、合理的人类活动（如植树造林）能增加植被覆盖度，改善生态环境,
改良,锚点词,土壤与植被,只施化肥
改造,锚点词,土壤与植被,保持水土、保肥
放牧,锚点词,土壤与植被,土壤沙化、退化
散失,锚点词,土壤与植被,温带季风区
施用,锚点词,土壤与植被,退化
施用石灰,选项词,题目选项,
施肥,锚点词,土壤与植被,水稻土
无变化,选项词,题目选项,
无木质茎,土壤与植被,植株矮小，无木质茎，生长周期较短,
无法,锚点词,土壤与植被,林线
无需调节pH值,土壤与植被,中性土壤适合种植大多数农作物，无需调节pH值,
无高大乔木,土壤与植被,植被以草本植物为主，无高大乔木,
时间,锚点词,土壤与植被,苔原
旺盛,锚点词,土壤与植被,土壤盐碱化
明显,锚点词,土壤与植被,土层浅薄
易干旱,土壤与植被,保水保肥能力弱，易干旱、养分易流失,
易积水,土壤与植被,孔隙度小，透气性和透水性差，易积水,
是农业生产的理想土壤,土壤与植被,壤土适合种植多种农作物，是农业生产的理想土壤,
是森林植被的主要组成部分,土壤与植被,是森林植被的主要组成部分，能调节气候、涵养水源,
是森林植被的主要组成部分，能调节气候、涵养水源,决策型,题目选项,是森林植被的主要组成部分、能调节气候、涵养水源
是植物的“摇篮”,土壤与植被,为植物生长提供生长介质和养分，是植物的“摇篮”,
暖温带,锚点词,土壤与植被,肥力更高
更加茂盛,选项词,题目选项,
更板结,选项词,题目选项,
更肥沃,决策型,题目选项,
最适合农业生产,土壤与植被,壤土：通气性和保水性都适中，最适合农业生产,
有效,锚点词,土壤与植被,增施有机肥
有机肥,锚点词,土壤与植被、砂土中添加黏土和有机肥，能改善保水保肥能力、碱性土壤可施加石膏、有机肥，降低土壤碱性,退化
有机质,锚点词,土壤与植被,干旱风沙区
有机质低,决策型,题目选项,
有机质分解快,土壤与植被,有机质分解快、流失多,
有机质分解快、流失多,决策型,题目选项,有机质分解快、流失多
有机质含量越低,土壤与植被,气温越高，土壤有机质分解速度越快，有机质含量越低,
有机质含量较低,土壤与植被,土壤呈酸性，有机质含量较低，肥力中等,
有机质含量较高,土壤与植被,温带大陆性气候区，降水少，蒸发旺盛，土壤多碱性，有机质含量较高,
有机质含量高,土壤与植被,黑土颜色深，有机质含量高，肥力强,
有机质极高,选项词,题目选项,
有机质积累,生物地理,成土过程,低温湿润、植物枯枝落叶、微生物分解慢、棕壤
有机质高,选项词,题目选项,
来源于,锚点词,土壤与植被,低温湿润区
松散,锚点词,土壤与植被,侵蚀、滑塌
板结,锚点词,土壤与植被,退化
极厚,锚点词,土壤与植被,肥力高
极易,锚点词,土壤与植被,土壤盐碱化
极端干旱区,选项词,题目选项,
林线,决策型,题目选项,
枯枝落叶多,土壤与植被,冠层厚、枯枝落叶多,
柑橘等喜酸作物,土壤与植被,酸性土壤适合种植茶树、柑橘等喜酸作物,
栗钙土,土壤与植被,温带季风气候区对应棕壤、褐土，温带大陆性气候区对应黑钙土、栗钙土,
根系,土壤与植被,主要来源于植物的枯枝落叶、根系和动物的排泄物、尸体,
根系发达,土壤与植被,根系发达，能固定土壤，减少风沙侵蚀、根系发达，能深入地下吸收水分、根系发达，能适应贫瘠的土壤、根系发达，能深入地下吸收水分和养分，固定土壤能力强,
根系发达，能固定土壤，减少风沙侵蚀,决策型,题目选项,根系发达、能固定土壤、减少风沙侵蚀
根系发达，能深入地下吸收水分,决策型,题目选项,根系发达、能深入地下吸收水分
根系发达，能深入地下吸收水分和养分，固定土壤能力强,决策型,题目选项,根系发达、能深入地下吸收水分和养分、能深入地下吸收水分、养分、固定土壤能力强
根系发达，能适应贫瘠的土壤,决策型,题目选项,根系发达、能适应贫瘠的土壤
根系呼吸,决策型,题目选项,
根系和动物的排泄物,土壤与植被,主要来源于植物的枯枝落叶、根系和动物的排泄物、尸体,
根系多为须根,土壤与植被,根系多为须根，能快速吸收水分和养分,
根系多为须根，能快速吸收水分和养分,决策型,题目选项,根系多为须根、能快速吸收水分和养分、能快速吸收水分、养分
根系更浅,选项词,题目选项,
梯田,锚点词,土壤与植被,保持水土、保肥
棕壤,决策型,题目选项、北方地区多中性、碱性土壤，如黑土、棕壤、褐土主要分布在温带地区,
棕壤、褐土主要分布在温带地区,决策型,题目选项,棕壤、褐土主要分布在温带地区、黑土主要分布在温带（如我国东北）。、黑土主要分布在温带（如我国东北）
森林,土壤与植被,题目选项、森林、草原、荒漠都属于陆生植被,
森林 — 黑土,选项词,题目选项,
森林→草原→荒漠,决策型,题目选项,
森林→荒漠→草原,选项词,题目选项,
森林、草原、荒漠都属于陆生植被,决策型,题目选项,森林、草原、荒漠都属于陆生植被
森林主要生态功能,植被类型,植被,涵养水源
森林区,锚点词,土壤与植被,水分
森林景观功能,植被类型,植被,美化环境
森林植被的垂直分层最明显,土壤与植被,森林植被的垂直分层最明显，可分为乔木层、灌木层、草本层,
森林植被的垂直分层最明显，可分为乔木层、灌木层、草本层,决策型,题目选项,森林植被的垂直分层最明显、可分为乔木层、灌木层、草本层、并非所有植被都有明显垂直分层，如草原、荒漠分层简单。、并非所有植被都有明显垂直分层
森林植被的枯枝落叶分解后,土壤与植被,森林植被的枯枝落叶分解后，能增加土壤有机质，提高土壤肥力,
森林植被的枯枝落叶分解后，能增加土壤有机质，提高土壤肥力,决策型,题目选项,森林植被的枯枝落叶分解后、能增加土壤有机质、提高土壤肥力、森林植被能维持土壤肥力，形成良性循环。、森林植被能维持土壤肥力
森林植被的根系能疏松土壤,土壤与植被,森林植被的根系能疏松土壤，改善土壤透气性和透水性,
森林植被的根系能疏松土壤，改善土壤透气性和透水性,决策型,题目选项,森林植被的根系能疏松土壤、改善土壤透气性和透水性、改善土壤透气性、透水性、森林植被能维持土壤肥力，形成良性循环。、森林植被能维持土壤肥力
森林植被要求土壤肥沃,土壤与植被,森林植被要求土壤肥沃、透气性好、水分充足,
森林植被要求土壤肥沃、透气性好、水分充足,决策型,题目选项,森林植被要求土壤肥沃、透气性好、水分充足
森林经济功能,植被类型,植被,提供木材
植树,锚点词,土壤与植被,固定沙丘、减弱风蚀
植树造林,土壤与植被,植树造林，提高植被覆盖度，能减少土壤侵蚀,
植树造林，提高植被覆盖度，能减少土壤侵蚀,决策型,题目选项,植树造林、提高植被覆盖度、能减少土壤侵蚀
植株矮小,土壤与植被,植株矮小，无木质茎，生长周期较短,
植株矮小，无木质茎，生长周期较短,决策型,题目选项,植株矮小、无木质茎、生长周期较短
植物,锚点词,土壤与植被,增施有机肥
植物会缺水枯萎,土壤与植被,土壤水分不足，植物会缺水枯萎；水分过多，会导致根系缺氧腐烂,
植物根系呼吸旺盛,土壤与植被,土壤空气充足，植物根系呼吸旺盛，生长健壮,
植物残体分解后能增加土壤有机质,土壤与植被,植物残体分解后能增加土壤有机质，提高土壤肥力,
植物残体分解后能增加土壤有机质，提高土壤肥力,决策型,题目选项,植物残体分解后能增加土壤有机质、提高土壤肥力
植物生长需要适宜的土壤水分,土壤与植被,植物生长需要适宜的土壤水分，过多或过少都会影响生长,
植物生长需要适宜的土壤水分，过多或过少都会影响生长,决策型,题目选项,植物生长需要适宜的土壤水分、过多或过少都会影响生长、过多、过少都会影响生长
植物的根系能疏松土壤,土壤与植被,植物的根系能疏松土壤，增加土壤透气性和透水性,
植物的根系能疏松土壤，增加土壤透气性和透水性,决策型,题目选项,植物的根系能疏松土壤、增加土壤透气性和透水性、增加土壤透气性、透水性
植被,土壤与植被,土壤与植被、植被与土壤相互制约，一方破坏会导致另一方退化,植被类型、植被特征、植被功能、季雨林、林线、森林、森林→草原→荒漠、森林→荒漠→草原、植被更加茂密、植被生长良好、温带草原区、湿润森林区、热带荒漠区、热带雨林区、苔原→针叶林→雨林、苔原、草甸、茂密森林、草原→森林→荒漠、草原、灌丛、荒漠→草原→森林、阔叶林→荒漠→雨林、雨林、雨林→阔叶林→针叶林→苔原、雨林气候
植被与土壤相互制约,土壤与植被,植被与土壤相互制约，一方破坏会导致另一方退化,
植被与土壤相互制约，一方破坏会导致另一方退化,决策型,题目选项,植被与土壤相互制约、植被、土壤相互制约、一方破坏会导致另一方退化
植被也能逐渐改良土壤,土壤与植被,贫瘠的土壤只能生长耐旱、耐贫瘠的植被，植被也能逐渐改良土壤,
植被以草本植物为主,土壤与植被,植被以草本植物为主，无高大乔木,
植被以草本植物为主，无高大乔木,决策型,题目选项,植被以草本植物为主、无高大乔木
植被以针叶树为主,土壤与植被,植被以针叶树为主，叶片细小，表面有蜡质，减少水分蒸发,
植被以针叶树为主，叶片细小，表面有蜡质，减少水分蒸发,决策型,题目选项,植被以针叶树为主、叶片细小、表面有蜡质、减少水分蒸发
植被光合作用强,土壤与植被,光照充足，植被光合作用强，生长旺盛,
植被功能,生物地理,植被,保持水土、涵养水源、调节气候、生物多样性
植被垂直地带性的变化规律,土壤与植被,植被垂直地带性的变化规律与纬度地带性的变化规律相似,
植被垂直地带性的变化规律与纬度地带性的变化规律相似,决策型,题目选项,植被垂直地带性的变化规律、纬度地带性的变化规律相似、垂直地带性随海拔升高而变化，与纬度地带性有相似性。、垂直地带性随海拔升高而变化、与纬度地带性有相似性、纬度地带性有相似性
植被垂直地带性越明显,土壤与植被,山地的海拔越高，植被垂直地带性越明显,
植被好,土壤与植被,土层厚、植被好,
植被层次丰富,土壤与植被,植被层次丰富，生物多样性高,
植被层次丰富，生物多样性高,决策型,题目选项,植被层次丰富、生物多样性高
植被恢复应选择适合当地气候,土壤与植被,植被恢复应选择适合当地气候和土壤条件的植物品种,
植被恢复应选择适合当地气候和土壤条件的植物品种,决策型,题目选项,植被恢复应选择适合当地气候、土壤条件的植物品种
植被恢复能增加植被覆盖度,土壤与植被,植被恢复能增加植被覆盖度，减少土壤侵蚀，改善生态环境,
植被恢复能增加植被覆盖度，减少土壤侵蚀，改善生态环境,决策型,题目选项,植被恢复能增加植被覆盖度、减少土壤侵蚀、改善生态环境
植被改变土壤的理化性质,土壤与植被,植被改变土壤的理化性质，土壤影响植被的生长和分布,
植被改变土壤的理化性质，土壤影响植被的生长和分布,决策型,题目选项,植被改变土壤的理化性质、土壤影响植被的生长和分布、土壤影响植被的生长
植被更加茂密,选项词,题目选项,
植被根系能固定土壤,土壤与植被,植被根系能固定土壤，减少水力和风力侵蚀,
植被根系能固定土壤，减少水力和风力侵蚀,决策型,题目选项,植被根系能固定土壤、减少水力和风力侵蚀、减少水力、风力侵蚀
植被根系能疏松土壤,土壤与植被,植被根系能疏松土壤，改善土壤结构,
植被根系能疏松土壤，改善土壤结构,决策型,题目选项,植被根系能疏松土壤、改善土壤结构
植被残体分解后增加土壤有机质,土壤与植被,植被残体分解后增加土壤有机质，提高土壤肥力,
植被残体分解后增加土壤有机质，提高土壤肥力,决策型,题目选项,植被残体分解后增加土壤有机质、提高土壤肥力
植被特征,生物地理,植被,根系、叶片特征、垂直分异、演替、乔木、灌木、草本
植被生长又能进一步改善土壤肥力,土壤与植被,肥沃的土壤能促进植被生长，植被生长又能进一步改善土壤肥力,
植被生长期主要集中在夏季,土壤与植被,温带地区四季分明，植被生长期主要集中在夏季,
植被生长期短,土壤与植被,寒带地区气温低，植被生长期短，甚至无植被生长,
植被生长期长,土壤与植被,热带地区气温高、降水足，植被生长期长，全年常绿,
植被生长良好,选项词,题目选项,
植被生长越旺盛,土壤与植被,土壤肥力越高，植被生长越旺盛，覆盖率越高、植被越茂盛，土壤肥力越高、土壤越肥沃，植被生长越旺盛,
植被生长速度快,土壤与植被,热量充足，植被生长速度快，生长期长,
植被破坏会减少涵养水源能力,土壤与植被,植被破坏会减少涵养水源能力，引发洪涝、干旱等灾害,
植被破坏会减少涵养水源能力，引发洪涝、干旱等灾害,决策型,题目选项,植被破坏会减少涵养水源能力、引发洪涝、干旱等灾害
植被破坏会加剧土壤侵蚀,土壤与植被,植被破坏会加剧土壤侵蚀，导致土层变薄、土壤肥力下降,
植被破坏会加剧土壤侵蚀，导致土层变薄、土壤肥力下降,决策型,题目选项,植被破坏会加剧土壤侵蚀、导致土层变薄、土壤肥力下降
植被稀疏,土壤与植被,植被稀疏，多为耐旱植物，叶片细小或退化为刺,
植被稀疏，多为耐旱植物，叶片细小或退化为刺,决策型,题目选项,植被稀疏、多为耐旱植物、叶片细小或退化为刺、叶片细小、退化为刺
植被类型,植被类型,植被,常绿阔叶林、热带雨林、苔原、荒漠、高山灌丛草甸
植被类型从常绿植被过渡为落叶植被,土壤与植被,纬度越高，气温越低，植被类型从常绿植被过渡为落叶植被、针叶植被,
植被类型越简单,土壤与植被,同一座山地，海拔越高，植被类型越简单，从森林过渡为草甸、荒漠,
植被类型随之变化,土壤与植被,海拔每升高1000米，气温约下降6℃，植被类型随之变化,
植被群落是一定区域内多种植物相互作用,土壤与植被,植被群落是一定区域内多种植物相互作用、相互依存形成的集合体,
植被群落是一定区域内多种植物相互作用、相互依存形成的集合体,决策型,题目选项,植被群落是一定区域内多种植物相互作用、相互依存形成的集合体
植被能吸收二氧化碳,土壤与植被,植被能吸收二氧化碳，释放氧气，缓解温室效应,
植被能吸收二氧化碳，释放氧气，缓解温室效应,决策型,题目选项,植被能吸收二氧化碳、释放氧气、缓解温室效应
植被能降低地表温度,土壤与植被,植被能降低地表温度，减少热岛效应,
植被能降低地表温度，减少热岛效应,决策型,题目选项,植被能降低地表温度、减少热岛效应
植被蒸腾作用能促进植物吸收水分,土壤与植被,植被蒸腾作用能促进植物吸收水分和养分，促进生长,
植被蒸腾作用能促进植物吸收水分和养分,土壤与植被,植被蒸腾作用能促进植物吸收水分和养分，促进生长,
植被蒸腾作用能促进植物吸收水分和养分，促进生长,决策型,题目选项,植被蒸腾作用能促进植物吸收水分和养分、植被蒸腾作用能促进植物吸收水分、养分、促进生长、蒸腾作用促进水分吸收和养分运输，但不是促进土壤水分蒸发。、蒸腾作用促进水分吸收和养分运输、蒸腾作用促进水分吸收
植被蒸腾作用能增加空气湿度,土壤与植被,植被蒸腾作用能增加空气湿度，调节局部气候,
植被蒸腾作用能增加空气湿度，调节局部气候,决策型,题目选项,植被蒸腾作用能增加空气湿度、调节局部气候
植被覆盖度低,土壤与植被,植被覆盖度低，地表缺乏保护,
植被覆盖度低，地表缺乏保护,决策型,题目选项,植被覆盖度低、地表缺乏保护
植被覆盖度越低,土壤与植被,植被覆盖度越低，土壤侵蚀越严重,
植被覆盖度越低，土壤侵蚀越严重,决策型,题目选项,植被覆盖度越低、土壤侵蚀越严重、植被破坏会加速土壤侵蚀。、植被破坏会加速土壤侵蚀
植被资源,土壤与植被,指导农业生产，合理利用土壤和植被资源，提高农作物产量,
植被越茂盛,土壤与植被,植被越茂盛，土壤肥力越高；土壤越肥沃，植被生长越旺盛,
植被越茂盛，土壤肥力越高；土壤越肥沃，植被生长越旺盛,决策型,题目选项,植被越茂盛、土壤肥力越高、土壤越肥沃、植被生长越旺盛
植被退化,土壤与植被,植被退化、死亡,
植被退化、死亡,决策型,题目选项,植被退化、死亡
次生盐碱化,决策型,题目选项,
死亡,土壤与植被,植被退化、死亡,
残体,锚点词,土壤与植被,低温湿润区
母质,锚点词,土壤与植被,呈碱性
比较贫瘠,决策型,题目选项,
