关键字,分类,上级,下级
南北纬60°-90°之间,决策型,题目选项,
南北纬60°附近,决策型,题目选项,
南半球,气象与气候,气候系统,更高、温带海洋性气候的形成主要受西风带和洋流影响
南半球气温变化,气象与气候,南半球气温变化与北半球相反,
南半球气温变化与北半球相反,决策型,题目选项,南半球气温变化、北半球相反、气温日变化和年变化具有这些规律，南北半球季节相反。、气温日变化、南北半球季节相反
南坡,锚点词,气候要素,更高
南方不受影响,气象与气候,寒潮主要影响我国北方地区，南方不受影响,
南极,锚点词,气候要素,全年寒冷，植被以苔原为主
南极大陆,决策型,题目选项,
南美洲,地理位置,大陆位置、气候要素,南美洲地区、欧洲西部
南美洲东南部,决策型,题目选项,
南美洲东海岸,决策型,题目选项,
南美洲亚马孙平原,决策型,题目选项,
南美洲西海岸热带沙漠气候延伸至赤道附近,气象与气候,南美洲西海岸热带沙漠气候延伸至赤道附近，受寒流影响,
南美洲西海岸热带沙漠气候延伸至赤道附近，受寒流影响,决策型,题目选项,南美洲西海岸热带沙漠气候延伸至赤道附近、受寒流影响
南美洲西海岸降水减少,决策型,题目选项,拉尼娜现象与厄尔尼诺相反，东太平洋海水降温，南美西海岸降水减少，东南亚降水增多。、南美西海岸降水减少
南美洲西海岸降水增多,决策型,题目选项,导致南美西海岸降水增多
厄尔尼诺,气象与气候,气候异常,东太平洋海水增温、南美降水增多、东南亚降水减少
厄尔尼诺现象,决策型,题目选项,厄尔尼诺
历时,气象与气候,持续时间,时间长度
历时短,气象与气候,降水强度大，历时短、对流雨降水强度大，历时短,
历时较长,气象与气候,锋面雨降水强度适中，历时较长,
原因,气象与气候,气候系统,气温升高、燃烧煤炭，石油等化石燃料、从陆地吹向海洋、季风气候、冷锋、我国季风气候的形成主要与海陆热力性质差异有关
原理,气象与气候,气候系统,从陆地吹向海洋、更多、A山地
反射,锚点词,气候要素,较强
反映,锚点词,气候要素,温带海洋性气候全年温和湿润
反气旋,气象与气候,天气系统,高压系统、下沉气流、晴朗天气
反气旋中心为高压,气象与气候,气旋中心为低压，反气旋中心为高压,
反气旋控制下多晴朗,气象与气候,气旋控制下多阴雨，反气旋控制下多晴朗,
反气旋气流辐散下沉,气象与气候,气旋气流辐合上升，反气旋气流辐散下沉,
发生,锚点词,过程特征、气候要素,发生过程、对流雨
发生变化,锚点词,气候要素,温带落叶阔叶林
受地形,气象与气候,马达加斯加岛东部为热带雨林气候，受地形和暖流影响,
受地形和暖流影响,气象与气候,马达加斯加岛东部为热带雨林气候，受地形和暖流影响,
受寒流影响,气象与气候,南美洲西海岸热带沙漠气候延伸至赤道附近，受寒流影响,
受海陆热力性质差异影响,决策型,题目选项,
受热带低压控制,气象与气候,台风多形成于热带海洋，受热带低压控制,
受西风,气象与气候,欧洲西部温带海洋性气候分布广泛，受西风和暖流影响,
受西风和暖流影响,气象与气候,欧洲西部温带海洋性气候分布广泛，受西风和暖流影响,
变化,气象与气候,气候变化、气候系统,季节变化、年际变化、长期变化、14:00、平原、温带落叶阔叶林、更高、炎热干燥、从山麓到山顶，降水先增多后减少、温带地区
变暖,气象与气候,气候变化、气候系统,全球气候变暖、海平面上升、极端天气频发、气温升高、全球降水普遍减少、燃烧煤炭，石油等化石燃料、某地区冬季出现极端寒潮，气温骤降、海拔较低的沿海平原
可能,气象与气候,气候影响、气候系统,潜在影响、14:00、寒冷干燥、夏季风强盛的年份、平原、温带落叶阔叶林、西北内陆地区、我国南方地区出现洪涝灾害、内陆地区、温带季风气候
台风,决策型,天气现象、气候要素、题目选项,台风天气、对流雨
台风主要影响我国东南沿海地区,决策型,题目选项,台风是热带气旋，形成于热带海洋，带来狂风暴雨风暴潮，主要影响我国东南沿海。、主要影响我国东南沿海
台风会带来狂风,气象与气候,台风会带来狂风、暴雨、风暴潮,
台风会带来狂风、暴雨、风暴潮,决策型,题目选项,台风会带来狂风、暴雨、风暴潮、台风是热带气旋，形成于热带海洋，带来狂风暴雨风暴潮，主要影响我国东南沿海。、带来狂风暴雨风暴潮
台风多形成于热带海洋,气象与气候,台风多形成于热带海洋，受热带低压控制,
台风多形成于热带海洋，受热带低压控制,决策型,题目选项,台风多形成于热带海洋、受热带低压控制、台风是热带气旋，形成于热带海洋，带来狂风暴雨风暴潮，主要影响我国东南沿海。、形成于热带海洋
叶片,锚点词,气候要素,油橄榄
合理安排种植制度,气象与气候,指导农业生产，合理安排种植制度,
同纬度地区,气象与气候,同纬度地区，夏季陆地气温高于海洋，冬季相反、同纬度地区，海拔每升高100米，气温约下降0.6℃,
同纬度地区，夏季陆地气温高于海洋，冬季相反,决策型,题目选项,同纬度地区、夏季陆地气温高于海洋、冬季相反、气温从赤道向两极递减、海陆热力差异导致同纬度冬夏气温海陆相反、海拔升高气温降低。
同纬度地区，海拔每升高100米，气温约下降0.6,气象与气候,nan,nan
同纬度地区，海拔每升高100米，气温约下降0.6℃,决策型,题目选项,同纬度地区、海拔每升高100米、气温约下降0.6℃、海拔升高气温降低
后者,锚点词,气候要素,亚热带季风气候
后退,锚点词,气候要素,暖锋
含量,锚点词,气候要素,降雪
吸收,锚点词,大气过程、气候要素,物质吸收、燃烧煤炭，石油等化石燃料
吸热快,气象与气候,城市硬化路面多，吸热快,
呈现,锚点词,气候要素,更强
因素,气象与气候,影响因素、气候系统,各种成因、热带雨林地区、陆地、青藏高原、内陆地区、降水丰富、热带沙漠气候、温带海洋性气候全年温和湿润、温带季风气候
国家,气象与气候,气候系统,我国季风气候的形成主要与海陆热力性质差异有关、海南岛
土壤,气象与气候,生态系统,土壤形成
土壤肥沃,气象与气候,温带季风气候区，土壤肥沃，有机质积累多,
土壤贫瘠,气象与气候,热带雨林气候区，土壤贫瘠，有机质分解快、热带沙漠气候区，土壤贫瘠，盐分含量高,
在于,气象与气候,气候系统,热带季风气候、亚热带季风气候、温带海洋性气候
地中海,地中海气候型,亚热带气候、气候系统,夏季炎热干燥、冬季温和多雨、降水季节分配不均、亚热带季风气候、地中海气候、适合种植耐旱作物，冬季可灌溉种植、炎热干燥、没有、南北纬30°-60°之间、油橄榄
地中海气候,决策型,题目选项,地中海气候夏季炎热干燥、地中海气候受副高和西风交替控制、地中海气候受副高
地中海气候冬季多雨,气象与气候,地中海气候冬季多雨，季风气候夏季多雨,
地中海气候冬季多雨，季风气候夏季多雨,决策型,题目选项,地中海气候冬季多雨、季风气候夏季多雨、两者都位于亚热带，夏季都炎热。但地中海气候冬季多雨，季风气候夏季多雨，雨热搭配不同。、但地中海气候冬季多雨
地中海沿岸,决策型,题目选项,
地势,气象与气候,气候系统,平原、冬冷夏热，降水稀少
地区,气象与气候,地理区域、气候系统,区域划分、对流雨、寒冷干燥、亚热带季风气候、甘蔗、温带海洋性气候、我国南方地区的降水主要受夏季风影响、冷锋、亚马孙平原、热带草原、热带雨林气候、水稻、海南岛、欧洲西部、气温升高、热带雨林地区、地中海气候、非洲北部、夏季风强盛的年份、暴雨、4-9月、内陆地区、降水集中在夏季、不结冰、较小、非洲撒哈拉沙漠、温带地区、降雪、北极圈附近、中纬度大陆西岸、陆地、青藏高原、南美洲东南部、夏季、平原、锋面雨、温带海洋性气候全年温和湿润、冰原气候、热带沙漠气候、较大、我国西北地区的干旱主要是因为远离海洋，降水稀少、温带季风气候、较强、全年炎热干燥、西北内陆地区、暖锋、仙人掌、降水丰富、热带季风气候、南北纬30°附近、更强、温带大陆性气候的冬冷夏热，年温差大
地形,决策型,气候形成因素、气候系统、题目选项,海拔影响、坡向影响、迎风坡多雨、背风坡少雨、对流雨、寒冷干燥、亚热带季风气候、陆地、平原、更高、更多、内陆地区、降水丰富、温带海洋性气候全年温和湿润、A山地
地形起伏越大,气象与气候,地形起伏越大，降水差异越明显,
地形起伏越大，降水差异越明显,决策型,题目选项,地形起伏越大、降水差异越明显
地形雨,决策型,题目选项,
地形雨多发生在山地迎风坡,决策型,题目选项,锋面雨在温带常见、地形雨在迎风坡、对流雨多发生在赤道或夏季午后。、对流雨多发生在赤道
地形雨降水强度随坡度增大而增强,决策型,题目选项,
地形（高原年较差大,气象与气候,地形（高原年较差大，平原小）,
地形（高原年较差大，平原小）,决策型,题目选项,地形（高原年较差大、平原小）
地球表面,锚点词,气候要素,青藏高原
地理,气象与气候,气候系统,温带海洋性气候全年温和湿润
地衣,锚点词,气候要素,北极圈附近
地衣等植被,气象与气候,有苔藓、地衣等植被,
地表,气象与气候,气候系统,热带雨林地区、仙人掌、冰原气候、热带沙漠气候、全年寒冷，植被以苔原为主
地转偏向力,决策型,题目选项,地转偏向力影响风向
地面,气象与气候,地球表面、气候系统,地面特征、燃烧煤炭，石油等化石燃料、较强
均位于亚热带地区,决策型,题目选项,两者都位于亚热带
均匀,气象与气候,降水特征、气候系统,季节分配均匀、中纬度大陆西岸、平原、温带海洋性气候、热带雨林气候、较大
坚硬,锚点词,气候要素,油橄榄
坡向,气象与气候,气候系统,寒冷干燥、更高
坡度,锚点词,气候要素,A山地
垂直,气象与气候,气候系统,从山麓到山顶，降水先增多后减少、温带落叶阔叶林、平原
城市,锚点词,人类活动、气候要素,城市影响、14:00
城市人口密集,气象与气候,城市人口密集、工业发达，废热排放多,
城市人口密集、工业发达，废热排放多,决策型,题目选项,城市人口密集、工业发达、废热排放多
城市植被少,气象与气候,城市植被少，调节气温能力弱,
城市植被少，调节气温能力弱,决策型,题目选项,城市植被少、调节气温能力弱
城市气温高于郊区,决策型,题目选项,热岛效应使城市气温高
城市热岛效应,气象与气候,修建水库、城市热岛效应,
城市硬化路面多,气象与气候,城市硬化路面多，吸热快,
城市硬化路面多，吸热快,决策型,题目选项,城市硬化路面多、吸热快
城市降水多于郊区,决策型,题目选项,降水较多
城市风力小于郊区,决策型,题目选项,风力较小
增加植被覆盖率,气象与气候,植树造林，增加植被覆盖率,
增多,气象与气候,气候变化、气候系统,数量增多、从山麓到山顶，降水先增多后减少、温带落叶阔叶林、某地区冬季出现极端寒潮，气温骤降、温带海洋性气候的形成主要受西风带和洋流影响
增温,锚点词,气候要素,降水丰富
增湿,锚点词,气候要素,降水丰富
夏季,决策型,题目选项、夏季，陆地升温快，形成低压，海洋形成高压，风从海洋吹向陆地,
夏季低于陆地,气象与气候,海洋冬季气温高于陆地，夏季低于陆地,
夏季凉爽,气象与气候,气温年较差小，冬季温和，夏季凉爽,
夏季午后,气象与气候,对流雨多出现于赤道地区和夏季午后,
夏季均炎热,决策型,题目选项,夏季都炎热
夏季炎热,气象与气候,夏季炎热，冬季寒冷,
夏季炎热干燥,决策型,题目选项,炎热干燥
夏季炎热，冬季寒冷,决策型,题目选项,夏季炎热、冬季寒冷、冬冷夏热
夏季盛行西南季风,气象与气候,夏季盛行西南季风，降水丰富,
夏季盛行西南季风，降水丰富,决策型,题目选项,夏季盛行西南季风、降水丰富、夏季西南季风来自海洋
夏季陆地气温高于海洋,气象与气候,同纬度地区，夏季陆地气温高于海洋，冬季相反,
夏季风势力稳定的年份,决策型,题目选项,
夏季风强盛的年份,决策型,题目选项,
夏季风来自海洋,气象与气候,夏季风来自海洋，温暖湿润,
夏季风来自海洋，温暖湿润,决策型,题目选项,夏季风来自海洋、温暖湿润、东亚和南亚季风夏季风均来自海洋、南亚季风夏季风均来自海洋
夏季风较弱的年份,决策型,题目选项,
夏季高温多雨,决策型,题目选项、夏季高温多雨，冬季寒冷干燥,亚热带季风气候夏季高温多雨、冬季温和少雨、冬季温
夏季高温多雨，冬季寒冷干燥,决策型,题目选项,夏季高温多雨、冬季寒冷干燥、温带季风气候夏季高温多雨，冬季寒冷干燥，年较差大，降水主要集中在夏季。、温带季风气候夏季高温多雨
夏季高温多雨，冬季温和少雨,决策型,题目选项,
夏季，陆地升温快，形成低压，海洋形成高压，风从海洋吹向陆地,决策型,题目选项,夏季、陆地升温快、形成低压、海洋形成高压、风从海洋吹向陆地
多为荒漠景观,气象与气候,植被稀少，多为荒漠景观,
多发生在夏季午后,决策型,题目选项,夏季午后常见
多晴朗,气象与气候,副热带高气压带：盛行下沉气流，多晴朗,
多样性,锚点词,气候要素,亚马孙平原
多由冷锋,气象与气候,多由冷锋或暖锋活动形成,
多由冷锋或暖锋活动形成,决策型,题目选项,多由冷锋、暖锋活动形成、锋面雨由冷暖空气交汇形成
多阴雨,气象与气候,赤道低气压带：盛行上升气流，多阴雨、副极地低气压带：冷暖空气交汇，多阴雨,
多雨,气象与气候,冬季温和多雨,
多雨地区建筑多尖顶,气象与气候,多雨地区建筑多尖顶，便于排水,
多雨地区建筑多尖顶，便于排水,决策型,题目选项,多雨地区建筑多尖顶、便于排水
大气,气象与气候,大气系统、气候系统,大气环流、气压系统、成分、全年炎热干燥、降水丰富、炎热干燥、热带沙漠气候、南北纬30°-60°之间
大气中的二氧化碳,气象与气候,大气中的二氧化碳、水汽能吸收地面长波辐射,
大气中的二氧化碳、水汽能吸收地面长波辐射,决策型,题目选项,大气中的二氧化碳、水汽能吸收地面长波辐射、温室气体吸收地面辐射
大气环流,决策型,题目选项,
大气逆辐射能补偿地面热量损失,决策型,题目选项,
大洋,锚点词,气候要素,我国季风气候的形成主要与海陆热力性质差异有关
大豆,决策型,题目选项,
大量,气象与气候,气候系统,燃烧煤炭，石油等化石燃料、我国南方地区的降水主要受夏季风影响、全球降水普遍减少
大陆,地理位置,海陆位置、气候系统,大陆性气候、年较差大、全年寒冷，植被以苔原为主、亚热带季风气候、全年炎热干燥、地中海气候、中纬度大陆西岸、温带海洋性气候、降水丰富、我国季风气候的形成主要与海陆热力性质差异有关、降水集中在夏季、热带沙漠气候、没有、冬冷夏热，降水稀少、海南岛
大陆性气候,温带大陆性气候型,温带气候、气候系统,温带大陆性气候特征、适合种植耐旱作物，且瓜果甜度高、温带海洋性气候、降水集中在夏季、热带沙漠气候、温带大陆性气候的冬冷夏热，年温差大、冬冷夏热，降水稀少、温带季风气候
大陆性气候少）,气象与气候,降水多少（季风气候降水多，大陆性气候少）,
大陆性气候更均匀）,气象与气候,降水季节分配（季风气候集中夏季，大陆性气候更均匀）,
大雨,锚点词,气候要素,暴雨
大雾会影响航空交通,决策型,题目选项,
大风,决策型,天气现象、气候要素、阴天、大风、题目选项,大风天气、冷锋
大风、降温、降雨,决策型,题目选项,
天气,气象与气候,天气系统、气候系统,阴雨、晴朗、大风、降温、连续性阴雨天气、暖锋、冷锋、温带海洋性气候全年温和湿润、某地区冬季出现极端寒潮，气温骤降
天气状况（晴天日较差大,气象与气候,天气状况（晴天日较差大，阴天小）,
天气状况（晴天日较差大，阴天小）,决策型,题目选项,天气状况（晴天日较差大、阴天小）、日较差大、日较差大于海洋、日较差较大
天气转晴,气象与气候,冷锋过境后，气温下降，气压升高，天气转晴、暖锋过境后，气温上升，气压下降，天气转晴,
太平洋,地理位置,海洋位置、气候系统,太平洋地区、我国季风气候的形成主要与海陆热力性质差异有关、季风气候、我国南方地区出现洪涝灾害
太平洋东部海水温度升高,决策型,题目选项,东太平洋海水异常增温
太平洋东部海水温度降低,决策型,题目选项,东太平洋海水降温
太阳,气象与气候,气候系统,更高、较强、更强、温带季风气候
太阳辐射,决策型,能量来源、气候系统、题目选项,太阳能量、较强、青藏高原、更高、更强、温带季风气候、太阳辐射是根本动力
太阳辐射增强,决策型,题目选项,
季节,气象与气候,时间周期、气候系统,季节变化、地中海气候、夏季、更高、炎热干燥、热带雨林气候
季节变化小,气象与气候,热带雨林气候区，河流径流量大，季节变化小,
季风,气象与气候,大气环流、气候系统,季风环流、从陆地吹向海洋、更多、热带雨林气候、热带沙漠气候、热带季风气候、海南岛
季风气候,决策型,题目选项,
季风气候区易发生旱涝灾害,决策型,题目选项,季风气候降水
季风气候区降水季节变化大,决策型,题目选项,季风气候降水和风向季节变化大，不稳定易导致旱涝，但雨热同期对农业有利。、季风气候降水和风向季节变化大、季风气候降水、风向季节变化大
季风气候区雨热同期,气象与气候,季风气候区雨热同期，利于农业生产,
季风气候区雨热同期，利于农业生产,决策型,题目选项,季风气候区雨热同期、利于农业生产、季风气候降水和风向季节变化大，不稳定易导致旱涝，但雨热同期对农业有利。、但雨热同期对农业有利
季风气候夏季多雨,气象与气候,地中海气候冬季多雨，季风气候夏季多雨,
季风越强,气象与气候,海陆热力性质差异越显著，季风越强,
学科,气象与气候,气候系统,温带海洋性气候全年温和湿润
定义,锚点词,气候要素,温带海洋性气候全年温和湿润
容易,气象与气候,气候系统,暴雨、海拔较低的沿海平原
寒冷,气象与气候,气温特征、气候系统,低温为主、旱地农业、北极圈附近、热带雨林地区、夏季、我国北方地区冬季寒冷干燥主要受西北风影响、冰原气候、较大、全年寒冷，植被以苔原为主、海南岛、温带季风气候
寒冷干燥,决策型,题目选项、冬季风来自陆地，寒冷干燥、极地东风带：从极地吹向副极地，寒冷干燥,
寒带,地理位置,纬度地带、气候系统,高纬度地区、全年寒冷、降雪、北极圈附近、温带海洋性气候、冰原气候、全年寒冷，植被以苔原为主、温带地区
寒带冰原气候,决策型,题目选项,热带沙漠气候、温带大陆性气候、寒带气候（冰原、苔原）降水量都很少。
寒带地区,决策型,题目选项,
寒带地区建筑多厚重,气象与气候,寒带地区建筑多厚重、保暖，以抵御严寒,
寒带地区建筑多厚重、保暖，以抵御严寒,决策型,题目选项,寒带地区建筑多厚重、保暖、以抵御严寒
寒带多冰屋）,气象与气候,民居（热带多高脚屋，寒带多冰屋）,
寒带气候,决策型,题目选项、最冷月气温<0℃，为温带或寒带气候,寒带气候最冷月均温都低于0℃
寒带气候不适合农业生产,决策型,题目选项,气候类型决定农业类型，热带、温带、寒带分别适合不同的作物或基本不适合。、寒带分别适合不同的作物
寒带气候主要分布在两极地区,决策型,题目选项,气候类型分布具有纬度地带性，热带在回归线间，温带在中纬度，寒带在高纬度。、气候类型分布具有纬度地带性
寒带穿厚衣）,气象与气候,衣着（热带穿短袖，寒带穿厚衣）,
寒带苔原,决策型,题目选项,
寒带苔原气候,决策型,题目选项,
寒流,锚点词,气候要素,降水丰富
寒潮,锚点词,天气现象、气候要素,寒潮天气、某地区冬季出现极端寒潮，气温骤降
寒潮主要影响我国北方地区,气象与气候,寒潮主要影响我国北方地区，南方不受影响,
寒潮主要影响我国北方地区，南方不受影响,决策型,题目选项,寒潮主要影响我国北方地区、南方不受影响
寒潮会带来大风,气象与气候,寒潮会带来大风、雨雪、冰冻等灾害,
寒潮会带来大风、雨雪、冰冻等灾害,决策型,题目选项,寒潮会带来大风、雨雪、冰冻等灾害、寒潮是强冷空气入侵，带来剧烈降温、大风、雨雪冰冻。南方也会受寒潮影响，只是强度可能减弱。、雨雪冰冻
寒潮天气易引发感冒,气象与气候,寒潮天气易引发感冒、关节炎,
寒潮天气易引发感冒、关节炎,决策型,题目选项,寒潮天气易引发感冒、关节炎
寒潮是强冷空气入侵带来的剧烈降温天气,决策型,题目选项,寒潮是强冷空气入侵，带来剧烈降温、大风、雨雪冰冻。南方也会受寒潮影响，只是强度可能减弱。、寒潮是强冷空气入侵、带来剧烈降温
对应,锚点词,气候要素,温带季风气候
对流,锚点词,气候要素,对流雨
对流雨,锚点词,气候要素,对流雨
对流雨多出现于赤道地区,气象与气候,对流雨多出现于赤道地区和夏季午后,
对流雨多出现于赤道地区和夏季午后,决策型,题目选项,对流雨多出现于赤道地区、夏季午后、锋面雨在温带常见、地形雨在迎风坡、对流雨多发生在赤道或夏季午后。、对流雨多发生在赤道或夏季午后、对流雨多发生在赤道
对流雨降水强度大,气象与气候,对流雨降水强度大，历时短,
对流雨降水强度大，历时短,决策型,题目选项,对流雨降水强度大、历时短、对流雨强度大历时短、锋面雨强度适中历时较长
导致,气象与气候,气候影响、气候系统,引起某种现象、海拔较低的沿海平原、全球降水普遍减少、气温升高、陆地、燃烧煤炭，石油等化石燃料、更高、我国南方地区出现洪涝灾害、某地区冬季出现极端寒潮，气温骤降、非洲撒哈拉沙漠、从山麓到山顶，降水先增多后减少
小时,锚点词,气候要素,暴雨
小雨,锚点词,气候要素,暴雨
小麦,决策型,题目选项,
少雨,气象与气候,降水特征、气候系统、冬季温和少雨,降水稀少、亚热带季风气候、地中海气候、不结冰、热带沙漠气候、水稻、海南岛
居住,锚点词,气候要素,较大
属于,气象与气候,气候系统,旱地农业、适合种植耐旱作物，且瓜果甜度高、亚热带季风气候、非洲北部、南美洲东南部、欧洲西部、不结冰、某地区冬季出现极端寒潮，气温骤降、全球降水普遍减少、水稻、油橄榄
山地,决策型,地形类型、气候系统,山地地形、寒冷干燥、平原、温带落叶阔叶林、更高、更多、降水丰富、8℃、A山地
山地地区,决策型,题目选项,
山地气候,气象与气候,气候系统,从山麓到山顶，降水先增多后减少、温带落叶阔叶林
山地海拔越高,气象与气候,山地海拔越高，降水越多（一定范围内）,
山地海拔越高，降水越多（一定范围内）,决策型,题目选项,山地海拔越高、降水越多（一定范围内）
山地迎风坡降水多,气象与气候,山地迎风坡降水多，背风坡降水少,
山地迎风坡降水多，背风坡降水少,决策型,题目选项,山地迎风坡降水多、背风坡降水少
山坡,锚点词,气候要素,更多
山脉,气象与气候,气候系统,更多、亚热带季风气候
山腰,锚点词,气候要素,温带落叶阔叶林
山谷地区夜间气温高于山坡,气象与气候,山谷地区夜间气温高于山坡，形成山谷风,
