关键字,分类,上级,下级
山谷地区夜间气温高于山坡，形成山谷风,决策型,题目选项,山谷地区夜间气温高于山坡、形成山谷风
山顶,气象与气候,气候系统,从山麓到山顶，降水先增多后减少、温带落叶阔叶林、寒冷干燥、8℃
山麓,气象与气候,气候系统,从山麓到山顶，降水先增多后减少、温带落叶阔叶林、寒冷干燥、8℃
岛屿,决策型,题目选项,
岩石,锚点词,气候要素,热带雨林地区
崩解,锚点词,气候要素,热带雨林地区
工业发达,气象与气候,城市人口密集、工业发达，废热排放多,
差值,气象与气候,气候系统,14:00、温带地区、内陆地区
差异,气象与气候,气候差异、气候系统,海陆差异、纬度差异、地形差异、亚热带季风气候、陆地、温带海洋性气候、从陆地吹向海洋、季风气候、我国季风气候的形成主要与海陆热力性质差异有关、冰原气候、热带沙漠气候、没有、从山麓到山顶，降水先增多后减少、热带季风气候、温带季风气候
带来,气象与气候,气候影响、气候系统,导致某种结果、夏季风强盛的年份、中纬度大陆西岸、我国南方地区的降水主要受夏季风影响、4-9月、锋面雨、我国北方地区冬季寒冷干燥主要受西北风影响、非洲撒哈拉沙漠、南北纬30°-60°之间、温带海洋性气候的形成主要受西风带和洋流影响
常伴有雷电,气象与气候,范围小，常伴有雷电,
常见,气象与气候,气候系统,我国南方地区出现洪涝灾害、温带季风气候
干季,气象与气候,气候系统,热带草原、夏季
干季降水稀少,气象与气候,湿季降水丰富，干季降水稀少,
干旱,气象与气候,气候系统,我国西北地区的干旱主要是因为远离海洋，降水稀少、适合种植耐旱作物，且瓜果甜度高、夏季风强盛的年份
干湿,气象与气候,湿度特征、气候系统,干湿变化、热带草原、热带季风气候
干燥,气象与气候,湿度特征、气候系统,降水稀少、蒸发旺盛、旱地农业、北极圈附近、热带雨林地区、地中海气候、南美洲东南部、全年炎热干燥、夏季、仙人掌、适合种植耐旱作物，冬季可灌溉种植、我国北方地区冬季寒冷干燥主要受西北风影响、热带沙漠气候、非洲撒哈拉沙漠、较大、海南岛、油橄榄、温带季风气候
平原,决策型,地形类型、气候系统,平原地形、平原、不结冰
平原小）,气象与气候,地形（高原年较差大，平原小）,
平均,锚点词,气候要素,温带海洋性气候全年温和湿润
平坦,气象与气候,气候系统,平原、冬冷夏热，降水稀少
年份,锚点词,气候要素,夏季风强盛的年份
年较差都很大,气象与气候,气温日较差和年较差都很大,
废热排放多,气象与气候,城市人口密集、工业发达，废热排放多,
建筑,气象与气候,人类活动,建筑设计
引发,气象与气候,气候系统,暴雨、夏季风强盛的年份
强度,锚点词,现象强度、气候要素,强弱程度、暴雨
强弱,气象与气候,气候系统,青藏高原、较强、夏季风强盛的年份
强烈,锚点词,气候要素,热带雨林地区
强盛,锚点词,气候要素,夏季风强盛的年份
形成,气象与气候,气候成因、气候系统,多种因素综合作用、对流雨、我国南方地区的降水主要受夏季风影响、冷锋、更多、4-9月、降水集中在夏季、非洲撒哈拉沙漠、南北纬30°-60°之间、A山地、连续性阴雨天气、降雪、夏季、锋面雨、我国季风气候的形成主要与海陆热力性质差异有关、热带沙漠气候、全年炎热干燥、从陆地吹向海洋、暖锋、降水丰富、没有
形成低压,气象与气候,夏季，陆地升温快，形成低压，海洋形成高压，风从海洋吹向陆地,
形成山谷风,气象与气候,山谷地区夜间气温高于山坡，形成山谷风,
形成温带海洋性气候,气象与气候,西风带控制，形成温带海洋性气候,
形成热带沙漠气候,气象与气候,副热带高气压带控制，形成热带沙漠气候,
形成热带雨林气候,气象与气候,赤道低气压带控制，形成热带雨林气候,
形成雨影区,气象与气候,背风坡降水稀少，形成雨影区,
形成高压,气象与气候,冬季，陆地降温快，形成高压，海洋形成低压，风从陆地吹向海洋,
影响,气象与气候,气候系统,寒冷干燥、适合种植耐旱作物，且瓜果甜度高、亚热带季风气候、甘蔗、温带海洋性气候、我国南方地区的降水主要受夏季风影响、季风气候、冷锋、全球降水普遍减少、欧洲西部、海南岛、气温升高、热带雨林地区、夏季风强盛的年份、更高、更多、4-9月、内陆地区、降水集中在夏季、较小、冬冷夏热，降水稀少、南北纬30°-60°之间、连续性阴雨天气、中纬度大陆西岸、陆地、平原、锋面雨、适合种植耐旱作物，冬季可灌溉种植、温带海洋性气候全年温和湿润、热带沙漠气候、某地区冬季出现极端寒潮，气温骤降、海拔较低的沿海平原、我国西北地区的干旱主要是因为远离海洋，降水稀少、温带季风气候、温带海洋性气候的形成主要受西风带和洋流影响、较强、全年炎热干燥、西北内陆地区、我国南方地区出现洪涝灾害、降水丰富、没有、热带季风气候、较大、8℃
影响农业生产,气象与气候,中低纬度地区可能出现干旱，影响农业生产,
影响太阳辐射的多少,决策型,题目选项,
影响降水的分布,决策型,题目选项,
径流量小,气象与气候,热带沙漠气候区，河流稀少，径流量小,
微弱,气象与气候,气候系统,降雪、热带雨林地区
必要条件,锚点词,气候要素,降水丰富
性质,气象与气候,物质性质、气候系统,特性描述、陆地、从陆地吹向海洋、季风气候、我国季风气候的形成主要与海陆热力性质差异有关、没有
情况,锚点词,气候要素,14:00
成因,气象与气候,气候系统,降雪、中纬度大陆西岸、非洲北部、燃烧煤炭，石油等化石燃料、我国南方地区的降水主要受夏季风影响、我国季风气候的形成主要与海陆热力性质差异有关、我国北方地区冬季寒冷干燥主要受西北风影响、我国西北地区的干旱主要是因为远离海洋，降水稀少、温带海洋性气候的形成主要受西风带和洋流影响
我国北方地区冬季寒冷干燥与夏季风有关,决策型,题目选项,
我国北方地区冬季寒冷干燥主要受西北风影响,决策型,题目选项,
我国北方地区冬季降水较多,决策型,题目选项,
我国北方地区出现严重干旱,决策型,题目选项,
我国南方地区出现洪涝灾害,决策型,题目选项,
我国南方地区的降水主要受夏季风影响,决策型,题目选项,
我国南方地区的降水主要来自陆地,决策型,题目选项,
我国南方地区的降水集中在冬季,决策型,题目选项,
我国季风气候主要分布在西北内陆地区,决策型,题目选项,
我国季风气候的形成与气压带风带移动无关,决策型,题目选项,
我国季风气候的形成主要与海陆热力性质差异有关,决策型,题目选项,
我国西北地区的干旱与地形无关,决策型,题目选项,
我国西北地区的干旱主要是因为受副热带高气压带控制,决策型,题目选项,
我国西北地区的干旱主要是因为远离海洋，降水稀少,决策型,题目选项,
抬升,气象与气候,大气运动、气候系统,空气抬升、降水丰富、对流雨、A山地
拉尼,气象与气候,气候异常,东太平洋海水降温、南美降水减少、东南亚降水增多
拉尼娜现象,决策型,题目选项,
指导农业生产,气象与气候,指导农业生产，合理安排种植制度,
指导农业生产，合理安排种植制度,决策型,题目选项,指导农业生产、合理安排种植制度
排放,气象与气候,人类活动、气候系统,气体排放、燃烧煤炭，石油等化石燃料、全球降水普遍减少
接受,锚点词,气候要素,更高
控制,气象与气候,气候控制、气候系统,气压带、风带、地形、连续性阴雨天气、全年炎热干燥、地中海气候、非洲北部、南美洲东南部、夏季、炎热干燥、我国北方地区冬季寒冷干燥主要受西北风影响、热带沙漠气候、非洲撒哈拉沙漠
推广清洁能源,决策型,题目选项,推广清洁能源是缓解气候变暖的主要措施
描述,锚点词,气候要素,全年寒冷，植被以苔原为主
撒哈拉沙漠,决策型,题目选项,撒哈拉沙漠和阿拉伯半岛位于副热带
改变,气象与气候,气候系统,亚热带季风气候、冷锋
效应,气象与气候,气候效应,各种效应
散射作用使晴朗天空呈蔚蓝色,决策型,题目选项,空气分子散射蓝光使天空蔚蓝
断流,决策型,题目选项,
方向,锚点词,气候要素,更多
方法,锚点词,气候要素,热带雨林气候
方面,气象与气候,气候系统,甘蔗、寒冷干燥
无明显季节变化,气象与气候,气温年较差小，无明显季节变化,
无明显干湿季,气象与气候,降水季节分配均匀，无明显干湿季,
无法,锚点词,气候要素,仙人掌
日出,锚点词,气候要素,14:00
日落,锚点词,气候要素,14:00
日较差,锚点词,气温特征、气候要素,日温差、内陆地区
日较差都大,气象与气候,气温年较差和日较差都大,
旱地农业,决策型,题目选项,
时间,气象与气候,气候系统,14:00、甘蔗、4-9月
旺盛,气象与气候,气候系统,降水集中在夏季、我国西北地区的干旱主要是因为远离海洋，降水稀少
明显,气象与气候,气候特征、气候系统,特征显著、亚热带季风气候、平原、温带海洋性气候、温带落叶阔叶林、我国南方地区的降水主要受夏季风影响、冷锋、热带沙漠气候、温带季风气候、从山麓到山顶，降水先增多后减少、热带季风气候、A山地
春季,决策型,题目选项,
是从,锚点词,气候要素,更强
是否,锚点词,气候要素,没有
显著,气象与气候,气候特征、气候系统,差异明显、热带雨林地区、季风气候、我国季风气候的形成主要与海陆热力性质差异有关、较大、海南岛、8℃、温带季风气候
普遍,锚点词,气候要素,平原
晴天,气象与气候,气候系统,青藏高原、较强
晴朗,气象与气候,天气现象,晴朗天气
晴朗少云,决策型,题目选项,天气晴朗少云
晴朗干燥,决策型,题目选项,
暖流,气象与气候,气候系统,降水丰富、温带海洋性气候的形成主要受西风带和洋流影响
暖流影响,气象与气候,马达加斯加岛东部为热带雨林气候，受地形和暖流影响、欧洲西部温带海洋性气候分布广泛，受西风和暖流影响,
暖湿气流,气象与气候,气候系统,亚热带季风气候、夏季风强盛的年份、中纬度大陆西岸、我国南方地区的降水主要受夏季风影响、更多、4-9月、锋面雨、降水丰富、降水集中在夏季、南北纬30°-60°之间、温带海洋性气候的形成主要受西风带和洋流影响
暖空气,锚点词,气候要素,暖锋
暖锋,决策型,天气系统、气候系统,暖锋过境、暖锋、冷锋
暖锋活动形成,气象与气候,多由冷锋或暖锋活动形成,
暖锋过境后,气象与气候,暖锋过境后，气温上升，气压下降，天气转晴,
暖锋过境后，气温上升，气压下降，天气转晴,决策型,题目选项,暖锋过境后、气温上升、气压下降、天气转晴、冷锋和暖锋过境后天气都转晴，但气温气压变化相反。锋面活动多，降水多。、冷锋和暖锋过境后天气都转晴、暖锋过境后天气都转晴
暴雨,决策型,天气现象、气候系统、题目选项、台风会带来狂风、暴雨、风暴潮、暴雪会影响公路、铁路交通,暴雨天气、暴雨、某地区冬季出现极端寒潮，气温骤降
暴雨、暴雪会影响公路、铁路交通,决策型,题目选项,暴雨、暴雪会影响公路、铁路交通、恶劣天气（暴雨、暴雪、大雾、高温）都会对交通安全和效率产生影响。
暴雨、雷电天气,决策型,题目选项,
暴雨洪涝,决策型,题目选项,
暴雪会影响公路,气象与气候,暴雨、暴雪会影响公路、铁路交通,
暴雪影响交通）,气象与气候,交通（暴雨、暴雪影响交通）,
更低,决策型,题目选项,
更多,决策型,题目选项,
更少,决策型,题目选项,
更弱,决策型,题目选项,
更强,决策型,题目选项,
更高,决策型,题目选项,
最低,锚点词,气候要素,温带地区
最低值,锚点词,气候要素,14:00
最低气温,锚点词,气候要素,内陆地区
最低气温出现在1月,气象与气候,一年中，北半球陆地最高气温出现在7月，最低气温出现在1月,
最低气温出现在日出前后,气象与气候,一天中，最高气温出现在14时左右，最低气温出现在日出前后,
最冷月气温<0℃,气象与气候,最冷月气温<0℃，为温带或寒带气候,
最冷月气温<0℃，为温带或寒带气候,决策型,题目选项,最冷月气温<0℃、为温带或寒带气候、为温带、寒带气候、以最冷月均温作为判断气候带的重要依据。、以最冷月均温作为判断气候带的重要依据
最冷月气温<0，为温带或寒带气候,气象与气候,nan,nan
最冷月气温>15℃,气象与气候,最冷月气温>15℃，为热带气候,
最冷月气温>15℃，为热带气候,决策型,题目选项,最冷月气温>15℃、为热带气候、以最冷月均温作为判断气候带的重要依据。、以最冷月均温作为判断气候带的重要依据
最冷月气温>15，为热带气候,气象与气候,nan,nan
最冷月气温在0-15之间，为亚热带或温带海洋性气候,气象与气候,nan,nan
最冷月气温在0℃-15℃之间,气象与气候,最冷月气温在0℃-15℃之间，为亚热带或温带海洋性气候,
最冷月气温在0℃-15℃之间，为亚热带或温带海洋性气候,决策型,题目选项,最冷月气温在0℃-15℃之间、为亚热带或温带海洋性气候、为亚热带、温带海洋性气候
最大,气象与气候,气候系统,我国季风气候的形成主要与海陆热力性质差异有关、更多
最强,锚点词,气候要素,青藏高原
最高,气象与气候,气候系统,温带地区、内陆地区
最高值,锚点词,气候要素,14:00
最高气温出现在14时左右,气象与气候,一天中，最高气温出现在14时左右，最低气温出现在日出前后,
月均,锚点词,气候要素,温带地区
有关,气象与气候,气候系统,较强、平原、青藏高原、内陆地区、我国南方地区出现洪涝灾害、非洲撒哈拉沙漠、A山地
有机质分解快,气象与气候,热带雨林气候区，土壤贫瘠，有机质分解快,
有机质积累多,气象与气候,温带季风气候区，土壤肥沃，有机质积累多,
有苔藓,气象与气候,有苔藓、地衣等植被,
有苔藓、地衣等植被,决策型,题目选项,有苔藓、地衣等植被
有，主要分布在东南沿海地区,决策型,题目选项,
有，主要分布在西北内陆地区,决策型,题目选项,
条件,气象与气候,气候系统,降水丰富、甘蔗
来源,锚点词,气候要素,青藏高原
来自,锚点词,风向来源、气候要素,风的来源地、夏季风强盛的年份
杨树,决策型,题目选项,
极低,决策型,题目选项,
极地,地理位置,纬度位置、气候系统,极地地区、南北纬30°附近、气温升高
极地东风带：从极地吹向副极地,气象与气候,极地东风带：从极地吹向副极地，寒冷干燥,
极地东风带：从极地吹向副极地，寒冷干燥,决策型,题目选项,极地东风带：从极地吹向副极地、寒冷干燥、信风稳定、西风北半球西南，南半球西北，温和湿润、极地东风寒冷干燥。、极地东风寒冷干燥
极端,锚点词,气候要素,某地区冬季出现极端寒潮，气温骤降
极端天气增多,决策型,题目选项,极端天气频发
极端暴雨天气增多,决策型,题目选项,
某地区全年温和湿润,决策型,题目选项,
某地区冬季出现极端寒潮，气温骤降,决策型,题目选项,
某地区夏季正常降雨,决策型,题目选项,
树叶,锚点词,气候要素,夏季
树叶茂盛,锚点词,气候要素,夏季
核心,气象与气候,气候系统,温带海洋性气候全年温和湿润、海南岛
根本,锚点词,气候要素,温带季风气候
格局,气象与气候,分布格局,空间分布
格陵兰岛,锚点词,气候要素,全年寒冷，植被以苔原为主
梅雨,锚点词,气候要素,连续性阴雨天气
植树造林,决策型,题目选项、植树造林，增加植被覆盖率,
植树造林，增加植被覆盖率,决策型,题目选项,植树造林、增加植被覆盖率、增加碳汇（植树）
植被,气象与气候,生态系统、气候系统,植物覆盖、旱地农业、北极圈附近、温带落叶阔叶林、夏季、仙人掌、亚马孙平原、热带草原、热带雨林气候、冰原气候、全年寒冷，植被以苔原为主、水稻、油橄榄、温带季风气候
植被为温带落叶阔叶林,气象与气候,温带海洋性气候区，植被为温带落叶阔叶林,
植被为热带草原,气象与气候,热带草原气候区，植被为热带草原,
植被为热带雨林,气象与气候,热带雨林气候区，植被为热带雨林,
植被分布范围北移,决策型,题目选项,植被北移
植被破坏,决策型,题目选项,
植被稀少,气象与气候,植被稀少，多为荒漠景观,
植被稀少，多为荒漠景观,决策型,题目选项,植被稀少、多为荒漠景观
植被茂密,气象与气候,全年高温多雨，植被茂密,
椰子）,气象与气候,热带气候适合种植热带作物（如橡胶、椰子）,
樟树,决策型,题目选项,
欧洲,锚点词,气候要素,欧洲西部
欧洲西部,决策型,题目选项,
欧洲西部温带海洋性气候分布广泛,气象与气候,欧洲西部温带海洋性气候分布广泛，受西风和暖流影响,
欧洲西部温带海洋性气候分布广泛，受西风和暖流影响,决策型,题目选项,欧洲西部温带海洋性气候分布广泛、受西风和暖流影响、受西风、暖流影响、这些是非地带性气候分布的典型例子，受地形、洋流等因素影响。
比热容,气象与气候,气候系统,温带大陆性气候的冬冷夏热，年温差大、较小
民居（热带多高脚屋,气象与气候,民居（热带多高脚屋，寒带多冰屋）,
民居（热带多高脚屋，寒带多冰屋）,决策型,题目选项,民居（热带多高脚屋、寒带多冰屋）
气体,气象与气候,大气成分、气候系统,气体类型、燃烧煤炭，石油等化石燃料、全球降水普遍减少
气候,气候型,气候系统,类型、要素、形成因素、旱地农业、寒冷干燥、适合种植耐旱作物，且瓜果甜度高、亚热带季风气候、甘蔗、温带海洋性气候、我国南方地区的降水主要受夏季风影响、季风气候、亚马孙平原、热带草原、热带雨林气候、全球降水普遍减少、水稻、气温升高、热带雨林地区、地中海气候、非洲北部、燃烧煤炭，石油等化石燃料、更高、更多、不结冰、较小、非洲撒哈拉沙漠、冬冷夏热，降水稀少、南北纬30°-60°之间、降雪、中纬度大陆西岸、陆地、南美洲东南部、适合种植耐旱作物，冬季可灌溉种植、炎热干燥、我国北方地区冬季寒冷干燥主要受西北风影响、温带海洋性气候全年温和湿润、冰原气候、热带沙漠气候、海拔较低的沿海平原、某地区冬季出现极端寒潮，气温骤降、我国西北地区的干旱主要是因为远离海洋，降水稀少、温带季风气候、全年炎热干燥、仙人掌、没有、热带季风气候、全年寒冷，植被以苔原为主、较大、油橄榄
气候区,气候区型,气候分类,气候分区
气候带,锚点词,气候要素,热带雨林气候
气候异常,气象与气候,气候系统,全球降水普遍减少、我国南方地区出现洪涝灾害
气压,气象与气候,气候要素、气候系统,高压、低压、气压带、夏季、冷锋、炎热干燥、热带沙漠气候、南北纬30°附近
气压下降,决策型,题目选项、暖锋过境后，气温上升，气压下降，天气转晴,气压降低
气压升高,气象与气候,冷锋过境后，气温下降，气压升高，天气转晴,
气旋,气象与气候,天气系统,低压系统、上升气流、阴雨天气
气旋中心为低压,气象与气候,气旋中心为低压，反气旋中心为高压,
气旋中心为低压，反气旋中心为高压,决策型,题目选项,气旋中心为低压、反气旋中心为高压、气旋低压、上升、阴雨、反气旋高压、下沉、晴朗。
气旋控制下多阴雨,气象与气候,气旋控制下多阴雨，反气旋控制下多晴朗,
气旋控制下多阴雨，反气旋控制下多晴朗,决策型,题目选项,气旋控制下多阴雨、反气旋控制下多晴朗、气旋低压、上升、阴雨、反气旋高压、下沉、晴朗。
气旋气流辐合上升,气象与气候,气旋气流辐合上升，反气旋气流辐散下沉,
气旋气流辐合上升，反气旋气流辐散下沉,决策型,题目选项,气旋气流辐合上升、反气旋气流辐散下沉、气旋低压、上升、阴雨、反气旋高压、下沉、晴朗。
气流,气象与气候,大气运动、气候系统,空气流动、全年炎热干燥、非洲北部、更多、降水丰富、我国北方地区冬季寒冷干燥主要受西北风影响、热带沙漠气候、非洲撒哈拉沙漠
气温,气象与气候,气候要素、气候系统,高温、寒冷、温和、年较差、日较差、14:00、寒冷干燥、亚热带季风气候、温带海洋性气候、冷锋、热带雨林气候、燃烧煤炭，石油等化石燃料、更高、内陆地区、降水集中在夏季、较小、温带地区、降雪、中纬度大陆西岸、陆地、平原、冰原气候、温带海洋性气候全年温和湿润、热带沙漠气候、较大、从山麓到山顶，降水先增多后减少、温带季风气候、温带海洋性气候的形成主要受西风带和洋流影响、温带落叶阔叶林、暖锋、温带大陆性气候的冬冷夏热，年温差大、更强、8℃
气温上升,决策型,题目选项、暖锋过境后，气温上升，气压下降，天气转晴,过境后气温升高
气温下降,气象与气候,冷锋过境后，气温下降，气压升高，天气转晴,
气温升高,决策型,题目选项,
气温年较差,气象与气候,气温年较差和日较差都大,
气温年较差和日较差都大,决策型,题目选项,气温年较差、日较差都大、温带大陆性气候大陆性强，冬冷夏热，降水少且多集中在夏季，气温年较差和日较差大。、气温年较差和日较差大、日较差大
气温年较差大,决策型,题目选项,年较差大
气温年较差小,决策型,题目选项、气温年较差小，冬季温和，夏季凉爽、气温年较差小，无明显季节变化,年较差小
气温年较差小，冬季温和，夏季凉爽,决策型,题目选项,气温年较差小、冬季温和、冬季温、夏季凉爽、年较差小
气温年较差小，无明显季节变化,决策型,题目选项,气温年较差小、无明显季节变化、年较差小
气温年较差越小,气象与气候,保温作用越强，气温年较差越小,
气温年较差（大陆性气候更大）,决策型,题目选项,温带季风气候降水多于大陆性气候，降水集中在夏季、大陆性气候降水较少，但可能集中在夏季，不是更均匀。大陆性气候年较差更大。、温带季风气候降水多于大陆性气候、大陆性气候降水较少、大陆性气候年较差更大
气温日较差,气象与气候,气温日较差和年较差都很大,
气温日较差和年较差都很大,决策型,题目选项,气温日较差、年较差都很大、热带沙漠气候炎热干燥，蒸发强，植被稀少，日较差和年较差大。、日较差和年较差大、年较差大
气温日较差大,决策型,题目选项,云量少导致气温日较差大、昼夜温差大
气温约下降0.6℃,气象与气候,同纬度地区，海拔每升高100米，气温约下降0.6℃,
气温越低,气象与气候,海拔越高，气温越低,
气温逐渐降低,气象与气候,从赤道向两极，气温逐渐降低,
气温高于阴坡,气象与气候,阳坡接受太阳辐射多，气温高于阴坡,
水分,气象与气候,气候系统,甘蔗、夏季、仙人掌、油橄榄
水汽,气象与气候,大气成分、气候系统,水汽含量、降水丰富、降雪、非洲北部
水汽能吸收地面长波辐射,气象与气候,大气中的二氧化碳、水汽能吸收地面长波辐射,
水田农业,决策型,题目选项,
水稻,决策型,题目选项,
沙漠,热带沙漠气候型,热带气候、气候系统,全年炎热干燥、降水稀少、蒸发旺盛、地中海气候、南美洲东南部、仙人掌、热带雨林气候、热带沙漠气候、非洲撒哈拉沙漠
没有,决策型,题目选项,
河流,锚点词,水文系统、气候要素,河流流量、不结冰
河流径流量大,气象与气候,热带雨林气候区，河流径流量大，季节变化小,
河流径流量季节变化大,气象与气候,温带季风气候区，河流径流量季节变化大,
河流稀少,气象与气候,热带沙漠气候区，河流稀少，径流量小,
油橄榄,决策型,题目选项,
